0.75;Right now one of our highest job growth sectors is Leisure and Hospitality. Weve added jobs that mostly fall within the restaurant and bar sector industry. These are not high-paying jobs as the U.S. Department of Labor estimates this is an industry sector with the lowest average wages and the lowest proportion of its workforce earning minimum or subminimum wage jobs.
0.25;Gov. Scott Walker bought 80 new brand-new vehicles for the state that we probably dont need.
0.5;Says he passed eight measures including ones to prevent groping at airport security checks and to bar sanctuary cities in Texas.
0;Its gotten to a point where the average federal worker makes twice as much as the average private sector worker.
0;These 15 political appointees on the IPAB will make all the major health care decisions for over 300 million Americans.
0.25;Says stores will be barred from selling 100-watt light bulbs as of 2012.
1;Before our last three presidents you have to go back to the 1800s early 1800s to find three presidents in a row being consecutively re-elected.
0.25;Jason Carter supports using Georgia tax dollars to promote Obamacare
0.75;The most recent Associated Press poll has Nader-Gonzalez at 6 percent without any national coverage against McCain and Obama.
0.5;Dan Patrick said that if women get paid less than a man for the same job that thats not a problem.
0.5;Weve got an average of 5600 soldiers committing suicide. Thats about 20 a day.
0.25;There have even been Republican congressmen who have said If you give us more money we dont know where we would even put additional Border Patrol agents.
1;Today for the first time in fifteen years Master Locks unionized plant in Milwaukee is running at full capacity.
1;Tom Reed has actually voted for every single trade deal that has ever come before him in any form.
0;ISIS camp a few miles from Texas Mexican authorities confirm.
0;New federal projections estimate that the health care overhaul will cost $1.76 trillion over 10 years -- well above the $940 billion Democrats originally claimed.
0;Say New Jersey Reps. Donald Payne and Frank Pallone are socialists who are openly serving in the U.S. Congress.
0;The unemployment rate may be as high as 42 percent.
0.75;Common Core is not from the federal government they do not have their fingerprints on this thing at all.
0;Social Security is indeed a Ponzi scheme.
0.25;Says Scott Walker brags a lot about having an independent agency investigate police shootings. Of course he didnt fund it.
0.75;What the Arizona law does is make a state crime out of something that already is... a federal crime.
0;When the country was founded Congress had exactly the same attitude about the sanctity of Christmas celebrations that a 7-Eleven does today: Yeah were open.
0.75;In Miami-Dade County we spend at our school system over $20 million every year educating recent immigrants.
0;The omnibus bill has only $3.8 billion in earmarks.
1;Trump proposed enacting the largest tax increase in American history.
1;Senator McCain has been talking tough about earmarks and thats good but earmarks account for about $18-billion of our budget.
0.5;Kim Myers voted repeatedly to raise taxes on the people of Broome County but made millions off of tax savings when her family business relocated its headquarters.
0.5;Californias Prop 60 which would requirecondom usein adult films would put workers in the adult film industry at riskfor lawsuits and harassment.
1;We pay among the highest tolls in the nation for the privilege of crossing that bridge.
0.5;Sens. Isaksons Chambliss Votes Against Unemployment Insurance Were Votes to Kill Nearly 6000 Georgia Jobs.
0.25;Says real estate taxes were put in place to pay for Obamacare.
0.5;Says today unemployment has been running near 12 percent or more for the last four years and the Legislature hasnt done much to lower it.
0;Says Kay Bailey Hutchison voted for sanctuary cities.
0.5;John Mica voted to borrow $10 trillion.
0.25;Says opponent Mary Burke told reporters she would have required workers to give up bargained-for healthcare and retirement benefits like Gov. Walker.
1;McCain hired some of the biggest lobbyists in Washington to run his campaign.
0.25;We do not want to raise anybodys tax rates. Thats never been on the table.
0.5;When terrorists killed more than 250 Americans in Lebanon under Ronald Reagan the Democrats didnt make that a partisan issue.
0.75;This is the first time a party has picked up multiple seats during a regular election since the mid 1980s making this the largest majority of any party in more than 25 years.
0;John wasnt this raging populist four years ago when he ran for president.
1;House Republicans who complained they didnt have enough time to consider a constitutional ban against oil drilling shoved through a proposal in just a few days to open state waters to oil drilling.
0;Says no one from the Bush family attended the 2012 Republican National Convention and there was no President Bush at the 2008 convention.
0;Crime is rising.
0.75;Flint Mich. is paying three times more for poison water than I am paying in Burlington Vt. for clean water.
0.25;Weve got a personal tax system thats so complicated it costs Americans about $500 billion a year to comply with the current tax code.
0;Says a Portland school gives Muslim students their own school provided prayer room prayer rugs and lets them out of class five times a day to pray to Allah.
0;Texas Republicans believe in abolishing Social Security abolishing V.A. health care.
0.5;The bulk of the people who are shot with a weapon other than these drug gangs taking on one another end up being shot with their own weapon.
0;In the case of General Motors the Bush administration wrote a check without asking for any conditions of change.
0.5;Salaries for URI faculty are second to last among New England land grant universities and in lowest 20 percent of major U.S. research institutions
0.25;Says Miami Congressman Carlos Curbelo supports drilling offshore and repeatedly voted against President Obamas ability to fight pollution and combat climate change.
0;When President then candidate Obama was asked to disclose some of his donors because there was suspicion of their being the foreign source of money into his campaign they refused to do it.
0;Oregon is the only state out of the 50 states in the USA that continues to pay 100% of the medical benefits for its employees and their families.
0;You wonder why you dont see Rand Paul as much
0.5;Says Donald Trump cashed in on Sept. 11collecting $150000 in federal funds intended to help small businesses recover even though days after the attack Trump said his properties were not affected.
0.25;Three years ago a newly elected President Obama told America that if Congress approved his plan to borrow nearly a trillion dollars he would hold unemployment below 8 percent.
0;An independent payment advisory board created by in the health care reform law is like a Medicare IRS with the power to cut Medicare in order to pay for new government programs.
0;The Mitchell Park Domes lose about $1 million-plus every year and the number of people going to the Domes has been going down.
0;Under a bill before the legislature youd have to go to court to fire an employee.
1;There is little if any evidence that the use of red light cameras in New Jersey has reduced the number or severity of accidents at the intersections where they are used.
0.75;In the entire public school system in Camden last year only three students graduated college ready.
1;Says nearly 29000 Oregonians almost 5 percent of all homeowners are 90 days or more delinquent on their mortgage.
0;Under the Hate Crimes bill any pastor preacher priest rabbi or imam who gives a sermon out of their moral traditions about sexual practices could be found guilty of a federal crime.
0.25;This is what President Obama said the jobless rate would be if we passed the stimulus: 5.6 percent.
0.5;George Allen and his colleagues in the Senate turned the biggest surplus in the history of the United States into the biggest deficit in the history of the United States.
0.5;Says President Obama has cracked down on employers who are attracting undocumented immigrants and hiring them more than any previous president.
0.75;Says Newt Gingrich made an affirmative statement that he would not only support but he would campaign for Republicans who were in support of the barbaric procedure known as partial-birth abortion.
0.25;U.S. global AIDS spending helped reduce political instability and violence by 40 percent in recipient nations.
0.5;I told the Congress thanks but no thanks on that Bridge to Nowhere.
0.75;The actual construction contracts that weve awarded to date have come in several hundred million dollars below estimates.
1;State school funding per pupil is down 16 percent compared to 2009 after adjusting for inflation.
0.5;Unemployment has fallen from 10 percent during the presidents first year in office to 8.5 percent today.
0.5;American voters remain steadfast in their support for immigration reform with a path to citizenship with more than 70 percent who want to see reform passed this year.
0;There were more people on welfare than working in 2013.
0.25;Says Tammy Baldwin introduced a bill that would require doctors and other health care workers to ask patients including young children whether they are gay lesbian bisexual or if they know their gender identity.
1;Says State Rep. Kristi Thibaut was an ACORN lobbyist.
0.5;Atlanta is the No. 1 trading point for sexual slavery in America. Between 100 and 200 girls are sold into slavery in Atlanta every month.
0.5;According to a national survey transit ridership among people age 16 to 34 increased 40 percent between 2001 and 2009.
1;In fiscal year 2011-2012 4191 abortions were paid for by taxpayers via the Oregon Health Plan.
0;Any legislative action that is taken now could very well be rendered completely null and void by the decision of the Supreme Court expected this June.
0.5;Im the only Republicancandidate that has actually reduced the size of government.
0;After how hard you work and how much you pay in taxes New York City ends up getting the money. Im Chris Jacobs. I think its time we have someone in Albany thats making sure our region gets our fair share
0.75;Amazing fact: Senate has already voted on more amendments in 2015 than Reid allowed ALL YEAR last year.
0.75;Says state Supreme Court candidate Joe Donald twice supported incumbent Justice Rebecca Bradley.
0.75;One out of every four students fails to earn a high school diploma. In our major cities across America half of our kids dont graduate.
0.25;There were 36 states where Republicans who were in charge refused to implement a state health insurance exchange.
0;Says a tweet he sent out wasnt saying check out a sex tape. It was just take a look at the background of Alicia Machado.
0;Aphotograph of 21-year-old Hillary Clinton featured a Confederate battle flag in the background.
1;Texas leads the nation in the percentage of residents without health insurance.
0;This administration and this Congress have been systematically cutting funding to border security since the Democrats took control.
0;A new college tuition reciprocity agreement with Minnesota makes college education more affordable for Wisconsin residents.
0.5;Says Cory Booker supports late-term and partial-birth abortion and opposes safety regulations.
0;Mitt Romney is the first major party candidate for president of the United States in modern times not to release at least 12 years of tax returns.
0.5;In the month of July alone EU exports to South Korea increased by over 36 percent. A lot of that is our market share. Those are our farmers and our service providers who are suffering.
0.75;Gov. Rick Perry spent over a million dollars on D.C. lobbyists asking for more federal money and lives in a luxury house that costs taxpayers $10000 a month.
0.5;As Virginia lost over 65000 jobs Tim Kaine put partisan ambitions first by serving as DNC chairman during the last year of his governorship.
0.5;The DNC says McCain flip-flopped on whether the Iraq War would be easy.
0.75;Says Ohio law gives tax breaks to rich people who own private jets.
0.5;Says Zack Space voted for budgets and debt energy taxes and the stimulus and we still lost more than 2.5 million jobs.
0;Says Paul Ryans budget plan ends Medicare.
0.5;In every ethics case that has resulted in a formal sanction theres been an investigative subcommittee thats been established first.
1;Says New Hampshire has the third-highest property tax in the country.
1;Obamas tax plan cuts taxes for 95 percent of all working families.
0.25;Says Colorado Democraticcongressional candidate MorganCarroll racked up $11 billion in new spending in the state Legislature.
0;59 percent of Americans today believe that Barack Obama is still a Muslim.
0;Carol Shea-Porter wants to increase taxes on small business and job creators.
0.25;People were hopeless. Sixty percent of the population 70 percent of the population wanted to live somewhere else. . . . By the time I left 70 percent wanted to stay.
1;A bill delaying the start of classes until Labor Day would permit school districts to shave 5 full weeks off the school year.
0;On whether the United States should intervene in Libya.
0.5;99.97 percent of the kids live in poverty that attend Cleveland public schools.
0.5;John Kitzhaber created 128000 new jobs while governor.
0.75;Says Texas ranks 49th nationally in what we are doing to support our per-pupil investment in education in the state.
0.25;Despite keeping distance from national media interviewers I did local press all along the last three months.
0;What we said was you can keep your plan if it hasnt changed since the law passed.
0.75;In 2006 Bernie Sanders voted in the House with hard-line Republicans for indefinite detention for undocumented immigrants and then he sided with those Republicans to stand with vigilantes known as Minutemen who were taking up outposts along the border to hunt down immigrants.
0;Says Florida didnt offer special incentives to Deutsche Bank which announced it will add 300 jobs in Florida.
0;Says she was the first in her family to go to a four-year college.
1;There was a Gallup poll in Egypt last year and 70 percent of Egyptians dont want our money.
1;The truth of the matter is that during my administration the FBIs crime statistics show that violent crime was reduced in Massachusetts by 7 percent.
0;Scott Maddox has run losing campaigns for 3 of Floridas 4 available cabinet positions.
1;Americans spend 6.1 billion hours a year on tax preparation.
0.75;The budget I managed at the Department of Education was more than $60 million.
0;We are now for the first time ever energy independent.
1;Last year Exxon pocketed nearly $4.7 million every hour.
0.5;AARP is the largest reseller of insurance in the country and has a vested interest in seeing that the market for reselling supplemental insurance expands.
0;Medicare monthly premiums will go up to $104.20 in 2012 and $247.00 in 2014 due to provisions incorporated in the Obamacare legislation purposely delayed so as not to confuse the 2012 re-election campaigns.
0.75;Right now 50 percent of Florida students leaving high school cannot read at grade level.
1;Says Republican Sen. John McCain won more votes for president in Cuyahoga County in the 2008 general election than he did in seven states.
0.25;Marco Rubio voted against funding health clinics that provide critical care during this public health emergency Zika.
0.5;Youre in more trouble if you leave your pet in the car than if you leave your child in the car.
0;SaysPeter Kilmartin voted in favor of expanding the good behavior statute to sex offenders.
1;On letting Occupy Atlanta protesters stay in Woodruff Park.
0.5;What I have put forward does not add a penny to the debt.
1;There are more African American men in prison jail on probation or parole than were enslaved in 1850.
0.75;In first week as governor Tim Kaine proposed a nearly $4 billion tax increase $4 billion including a tax increase on people earning as little as $17000 a year.
0.75;On Lee Fishers watch almost nine out of 10 jobs that Ohio lost were lost to other states not to other countries.
0.75;Every president has raised the debt ceiling.
0;Limiting labor negotiations to only wages is how it is for the most part in the private sector.
0.25;Says on contraception his plan is cheaper and easier for you than Sen. Mark Udalls
0.5;The states have always defined marriage.
0;Families in Del Valle who are City of Austin residents have to drive to Bastrop to go to the closest grocery store.
0.5;John McCain opposed legislation to fund levees and flood control programs which he considers pork.
0.5;Mitt Romneys pledged to protect oil companies record profits and their billions in special tax breaks too.
1;Mark Warner voted for nearly $1 trillion in new taxes and $7 trillion in new debt.
0.25;State government spending will be increase 10.7 percent this year.
0.25;Says Democrats first proposed prohibiting the government from negotiating prices for prescription drugs in Medicare Part D and he had nothing to do with that provision in the law.
0.5;The FCCs net neutrality policy includes whatis essentially a massive tax increase.
0.75;The typical white male worker in this country is making in real terms what he was making in 1973 and the average worker is making what they were making in 1996.
0;A United Nations arms treaty would almost certainly force the U.S. to create an international gun registry setting the stage for full-scale gun confiscation.
0.75;More people die from medical misadventures than firearm accidents nationally and in Florida.
0;When we took office let me remind you there was virtually no international pressure on Iran.
0.75;The minimum wage is mostly an entry-level wage for young people.
0.25;Says six studies verify that the math adds up for Mitt Romneys tax plan.
0.5;In the United States weve had 12 years in a row of wages declining.
0.5;Charlie Crist has six different positions on ObamaCare.
0.75;In the last few months alone we have apprehended extremists within our borders who were sent here from the border region of Afghanistan and Pakistan to commit new acts of terror.
1;As governor Ive stood up to ... the big oil companies.
0.75;This year were off to our best private-sector jobs growth since 1999.
0;Says abortion doctors are flying into this state performing abortions and flying out.
0.75;Speaker Gingrich for 20 years supported a federal individual mandate for health insurance.
0.75;There have been at least 100 shootings each year [Angel Taveras] has been mayor of Providence.
1;Maurice Ferre says Kendrick Meek has voted 98.6 percent of the time with the Democrat party.
0.5;Weve created more jobs in the United States than every other advanced economy combined since I came into office.
0.25;One in four inmates is an illegal immigrant.
1;Wisconsin is dead last in income growth among midwestern states during Gov. Scott Walkers term.
0;A three-cents-per-ounce soda tax in Philadelphia would result in the loss of 2000 family-sustaining Teamster Union jobs and countless other jobs in the beverage industry.
0.75;I have had the challenge during this administration to suspend no less than 37 public officials in about 36 months.
0.25;Kendrick Meek was #1 in Florida in taking tobacco cash and then opposed a tax on cigars that would have helped pay for childrens health care.
0.25;Federal Reserve policies have led to a 69 percent rise in corn prices 44 percent rise in wheat prices and 15 percent spike in sugar prices over the last year.
0;On repeal of Wisconsins smoking ban
0.75;Ninety percent of Texans say they do not want the nursing homes to close. It polls higher than anything else.
0.5;For the first time ever we completely funded the critical needs waiting list so persons with unique abilities can get the help they need.
0.5;Paul Ryan got his start in politics as a young staffer just out of college working for then-Congressman John Kasichs Budget Committee.
0.25;Race to the Top grants require participating states to adopt the Common Core standards as a condition for receiving federal funding.
0.5;President Obama in November of last year wiped away a program that allows for shared fingerprinting for those who are behind bars so you know who is here legally and illegally.
1;McCain sought the political support of minister John Hagee who believes Hurricane Katrina was Gods punishment for gay rights and called the Catholic Church the Antichrist and a 0 cult.
1;Says 51 percent of federal tax filers paid zero federal income tax.
0.75;Because of the 2011 debt ceiling fight the stock market lost 2000 points.
0;Since Wisconsin Gov. Scott Walker took office we are losing jobs at rates not seen in decades.
0.25;Says U.S. Senate rival Tammy Baldwin supports a tax increase that President Obama says would cost middle-class families $3000 per year.
1;I would be the first Republican senator elected in New Jersey in 41 years.
1;Wisconsins attorney general and state treasurer ordered the daughter of Earth Day founder Gaylord Nelson not to discuss climate change on state time.
0;Says unions take away hard-earned money of teachers firefighters and police officers to play politics.
0;President Bush never did one interview with the New York Times during his entire presidency.
0.75;14000 Americans . . . lose their health insurance every single day.
0;Mr. Trump is self-financing his campaign so we dont have any donors.
1;Nearly 2000 high schools - roughly 12 percent of all secondary schools in the United States - produce about half of the nations dropouts.
0.25;Embryonic stem cell research is at a dead end with no one good example of a successful treatment.
0.5;The U.S. spends more money on its military than the 16 biggest military budgets in the world combined.
0;Wisconsin has only one county Dane thats hand counting the votes in the 2016 presidential recount.
0.25;Says Libya Ambassador Christopher Stevens sent 600 requests for help in Benghazi.
0.5;The Affordable Care Act is bringing the cost of health care in our country down.
1;Tens of thousands of Atlanta households pay more than 30 percent of their income towards rent.
0.75;Rick Perry had planned to retire from the legislature until his best friend David Weeks and I talked him into switching parties and running for the GOP nomination for agriculture commissioner.
0.75;As the usage [of synthetic marijuana] has dramatically increased instances of violence bodily harm and even death have risen with it.
0.75;Out of 150000 tenured teachers in the last 10 years only 17 have been dismissed for incompetence.
0;The Providence teacher contract is one of the longest in the country.
0.5;In 1929 the Secretary of State shut down a program that was collecting information to protect America because it was unseemly but that move led to millions and millions of deaths in World War II.
0;Look at the debt that has been accumulated in the last two years. Its more debt under this president than all those other presidents combined.
0.5;The Chris Hani Baragwanath in South Africa is the worlds third-biggest hospital.
1;Annual precipitation has increased in Rhode Island by over 12 inches in the last century.
0.5;Says Connie Mack initially said he would have voted yes for the Paul Ryan budget plan and then you said it was stupid and you would vote no. And then your folks corrected you and you changed your position again yes.
1;The state budget proposal has been submitted on time and [its] the earliest that a governor has done so in over two decades.
1;Ohio is not meeting its obligation to update voter registrations when voters change their address with the BMV.
1;Vietnamese is the third most commonly spoken language in Texas.
0;What we have now is the most generous in my opinion good time bill in the entire United States.
0.25;There is no Plan B if the transportation referendum is not passed by voters.
0;Barack Obama wrote a thesis at Columbia University in which he criticized plutocratic thugs and said the Constitution gave Americans the shackles of hypocrisy.
0;Youll find blacks in almost every regiment throughout the South who fought right alongside white Southerners during the Civil War.
0;The most likely triggering cause of microcephaly is the DTaP shot a vaccine that had been recently mandated by the Brazilian government to be injected into pregnant women.
1;Our economy still has three people looking for every job opening.
1;Says she got unions to agree to about $10 million in reduction of salaries and health benefits while serving as Dane County executive in Wisconsin.
1;Democrats have lost more than 900 state legislators since Barack Obama has been president.
0.75;Carly Fiorina shes against banning assault weapons.
0;Hillarys baby bond proposal would give $5000 to each of the 4-million babies born in the U.S. each year totaling $20-billion per year multiplied by four years = $80-billion.
0.5;Says her campaign platform includes the biggest investment in new good-paying jobs since World War II.
0.5;Joe Biden brought Republicans and Democrats together to pass the 1994 crime bill putting 100000 cops on the streets and starting an eight-year drop in crime across the country.
0;If Rhode Island does a hybrid [retirement] plan well be the first state in the nation to do this.
1;Before the terrorist attacks in Benghazi the State Department not only failed to honor repeated requests for additional security but instead actually reduced security in Libya.
1;Failure to raise the debt limit does not force a U.S. default on debt payments.
0;Democrats in the Legislature in 2009 voted for various pork projects including a $5 million scoreboard for the Milwaukee Bucks.
0.5;Says Donald Trump has defended World War II internment camps.
