pants-fire;Says U.S. Rep. Ted Yoho said African Americans should only be given three-fifths of a vote.
0;We dont need a separate (prescription drug) database  Pharmacies already have a database in place.
0.75;A small business in my district needed 31 different permits and fees just to be able to expand.
0.75;The U.S. Department of Defense spends $80 million a year on prostate cancer research $25 million a year on ovarian cancer research and $150 million a year on breast cancer research.
0;FACT: Nothing in #Obamacare forces people out of their health plans.
1;After J.D. Hayworth was voted out of Congress he became a registered lobbyist who was paid thousands by a Florida corporation to lobby the very committee he used to serve on.
0.25;76 percent of doctors support the use of medical marijuana
1;Department of Education officials investigating Virginia Tech shootings have not once gotten into the car and driven down to Blacksburg to talk to the police chief or the university president or to anyone else.
0.5;We are dealing with an administration that quite frankly has shown a reluctance to enforce the immigration law.
1;When Social Security was passed there were all kinds of lawsuits just as there have been in the legal battle over the new health care law.
0;Says Damascus disincorporation would produce NO significant tax savings.
0;Scott Walker opposed a plan to help Wisconsin students refinance their student loans.
0;Lee Zeldin missed 2/3rds of Veterans Affairs Hearings
0.5;I have won more elections than any chairman since 1938.
0.75;500 percent more traffic here?
0;In Arizona there are only one and a half (Border Patrol) agents per every 10 square miles.
0.5;(McCain) says we cant have  timelines to draw down our troops from Iraq.
0.75;In Wisconsin a woman only earns 80 cents for every $1 a man earns.
0;Loranne Ausleys a financial train wreck for taxpayers -- pushing gas taxes property taxes taxes on seniors.
0.25;Grocery prices have risen significantly over the past year or so.
0.75;Sen. Kay Bailey Hutchisons concession speech came with less than 20 percent of the precincts having been counted.
0;I think we came down here (to Florida) one time  but we werent actively fundraising here.
0;Canadian-born Ted Cruz has had a double passport.
1;Says Holly Turner failed to vote in five straight Republican primaries.
0.5;The White House budget plan will bring domestic discretionary spending to its lowest share of our economy since Dwight Eisenhower was president.
0;The California governor says yes to poisoning more children with mercury and aluminum in vaccines.
0.75;Says Donald Trump has outlined policies that read like a Kremlin wish list.
1;Says Congressmen Paul Ryan and Todd Akin co-sponsored legislation to limit federal funding for abortion to victims of forcible rape.
0;SaysHillary Clinton wants to abolish the Second Amendment.
1;Less than half of the poorest American households have a home Internet subscription.
0.25;Said he is the only Democratic candidate for state attorney general who has represented the entire state of Georgia.
pants-fire;In 20 years there will be enough Muslim voters in the U.S. to elect the president by themselves.
1;During the past four years average wages have barely budged.
pants-fire;Donald Trump Protester Speaks Out: I Was Paid $3500 To Protest Trumps Rally.
pants-fire;Says Vladimir Putin said President Obama and his fellow Democrats are either idiots or deliberately trying to destroy their own economy.
0.25;McCain supports tax breaks for companies that ship jobs overseas.
pants-fire;ISIS is running through a border made porous by Barack Obamas policies.
0.75;Job losses are so certain under this new cap-and-tax plan that it includes a provision accommodating newly unemployed workers from the resulting dried-up energy sector to the tune of $4.2 billion over eight years. So much for creating jobs.
1;Says under federal law we do not have any limitation on the number of guns and bullets we can buy.
0;Studies have shown that voter fraud is non-existent in Texas.
0.75;Extending current tax rates would average more than $100000 a year to millionaires and even billionaires.
0.75;Over 22000 unique Internet Protocol addresses -- in Wisconsin alone -- have downloaded child pornography.
0;Its factually correct to say that Jennifer Brunner inherited at least 18 lawsuits when she came into the office that were a result of Ken Blackwells mismanagement of the 2004 election.
pants-fire;The ACLU has filed a suit to end prayer from the military completely.
0.25;Under President (George W.) Bush prosecution of gun crimes was 30 percent higher than it is under President Obama.
0;There are 300000 babies born deformed every year in this country because of women who are alcoholics while theyre carrying those children to term.
0.75;Says were losing one voter every 13 minutes.
0;Today we have two Vietnams side by side North and South exchanging and working.
0.25;A data system that goes along with Common Core is designed to collect up to 400 data points on each child which can include personally identifiable data.
pants-fire;Alison Alter got an F in attendance in 2016 as an Austin parks board member and was removed by a unanimous vote of the Austin City Council.
0;Says he got lobbied by a woman with late-stage cancer about vaccinating Texas girls against a virus that can cause cervical cancer.
1;Florida shelled out more money for drug testing than it saved by denying welfare benefits to people who tested positive for drugs.
0.75;Illegal immigration is lower than its been in 40 years.
1;Ive got a 94 percent career voting record in Congress while Bill Nelson has a 92 percent voting record.
1;When I was secretary of state I had a very high approval rating.
0;Kesha Rogers is not a Democrat.
0;Says House Republicans spent $50 million on 33 votes to repeal Obamacare.
pants-fire;Democrats are poised now to cause this largest tax increase in U.S. history.
0.5;Says under Mayor Cory Booker Newark has seen violent crime up five years in a row murder up five years in a row.
1;Seventy of Ohios 88 counties now have more than 25 percent of their residents eligible for emergency food.
0.75;Americanschools are more segregated than they were in the 1960s.
0.75;I was filibustered.
0.5;It was President Obamas inaction that caused over three weeks to go by before he even approved the governors plan to protect our marsh.
0.75;The Chinese last year probably stole $360 billion inintellectual property from the United States.
0.25;Almost nine out of every 10 pennies that would be spent turning a 200-mile stretch of Interstate 70 into a toll road would be from folks outside Missouri.
0.25;Greg Abbott said it would be a waste to expand pre-k to all Texas children.
0;It costs us logistically three times more to fight in Afghanistan than it does in any other place.
0.75;Some 500 detainees were released from Guantanamo during the Bush administration.
0.5;Youre more likely to be the victim of a violent crime in Milwaukee than in 96 percent of the country.
0.25;The average person who gets the minimum wage in America is 35 years old.
0.5;The majority of public funding for the Marlins stadium came from hotel taxes the burden of which is incurred by tourists who are visiting our city NOT the resident taxpayers.
0.75;More people today are leaving Virginia than moving in.
0.25;With Rick Scott there are more funds for preschool education.
pants-fire;The children coming across the southern U.S. border were never examined after they got here and quarantined if they had a disease. They were just sent out across the country. Many of them had measles  We now have an outbreak of it all because of our immigration policy.
0.5;The Mack Penny Plan for the federal budget would balance our budget by 2019 and continues to gain support.
0.75;Under the Arizona immigration law police are required to check immigration status if someones lawn is overgrown or if a dog is barking too loudly.
0.5;As a result of the House Republican bill the nonpartisan Congressional Budget Office now confirms that families will see their health care premiums reduced by up to 10 percent.
0;Says Thomas Jefferson helped craft the Constitution.
0.25;Says U.S. Rep. Tammy Baldwin a candidate for Senate supports raising taxes by $858 billion.
1;Right now here in Texas wind power is already cheaper than dirty fossil fuels.
0.25;Says the Obama administration plans to reduce the number of beds devoted to holding individuals violating immigration laws and to release hundreds of dangerous criminals into our communities.
0.25;Says Democratic challenger Russ Feingold was the deciding vote on Obamacare.
0.5;Florida has the most errors and exonerations from death row.
0;A recent economic uptick appears to coincide with the expectation of a new Republican Congress.
0.5;There is no precedent for what the Democrats are doing with this deception.  We have never written a reconciliation bill to amend a law that does not exist.
0;I was one of the few very few who voted `no on the Iran deal.
1;He (Kirk) did violate Pentagon rules twice actually for improperly mingling politics with his military service.
1;Oregon has never before tried to create a land-use plan for what it should look like for 50 years.
0;On expanding Medicaid under the Affordable Care Act.
0.25;Obamas plan to raise the capital gains tax hurts the middle class.
0.5;The House Zika bill limits access to birth control services needed to help curb the spread of the virus in Puerto Rico.
0.5;Says the claim that 40 percent of guns are sold without background checks traces to information gathered before background checks were even required.
0;Doctors kill about 250000 people a year in botched surgeries.
0;The White House branded the memorial service for the Tucson shootings with a Together We Thrive logo and slogan.
0.5;Obama changed the rules in Washington. Gone are the free gifts from lobbyists. Gone are the fancy airplane rides for nothing.
1;By the end of this budget Im in right now taxes will have been cut $4.7 billion in my state.
0.75;Says JoAnne Kloppenburg has told us she thinks its her job to promote a more equal society.
0;President Eisenhower on the night before the Normandy invasion[wrote a] letter of resignation to the United States Army for the failure of the landings at Normandy.
0.25;25 percent of our economy is the financial sector.
0;Barack Obama has reversed on his commitment to begin withdrawing American troops from Iraq immediately.
0.75;Illegal immigration and the crime rate are as low as theyve been in decades.
0;Between 2008 and 2014 criminal aliens accounted for 38 percentof all murder convictions in the five states of California Texas Arizona Florida and New York.
0;Repealing Obamacare saves our nation more than $2 trillion.
0.5;Statistics show that more people at this time telecommute than they ride carpools mass transit bicycle or walk.
0;We have constitutional amendment that says that theres a ban on drilling right off Floridas coast.
1;In President Barack Obamas 2015 State of the Union address the words al-Qaida were never used the first time those words have not been used in a State of the Union address since February 2001.
1;McCain voted 19 times against a minimum-wage increase.
0.75;Sen. Arlen Specters party switch could end up giving Republicans the ability to filibuster judicial nominees at the Judiciary Committee level so that the nominees never get out of committee.
1;Says only four Texas legislators voted against a law giving in-state tuition rates to certain illegal immigrants.
0;Oregon is the most trade-dependent state in the nation
1;In fact New Jersey is a donor state we get 61 cents back on every dollar we send to Washington. And interestingly Kentucky gets $1.51 on every dollar they send to Washington.
pants-fire;Says Barack Obama had huge majorities in Congress during his first two years in office and did nothing with them to create jobs in America.
0;Says Hillary Clinton is proposing to print instant work permits for millions of illegal immigrants to come in and take everybodys jobs including low-income African-Americans.
0.25;U.S. Sen. Lindsey Graham says South Carolina has a labor shortage and wants more immigration.
0.25;110 people a day move to Austin.
0.5;One of the interesting things about the Recovery Act was most of the projects came in under budget faster than expected because theres just not a lot of work there.
1;Were spending $12000 bucks a kid a year in the school system.
0.5;Says Austin has the lowest property tax rate by far of the five major cities in Texas.
0;I didnt support Sonia Sotomayor.
1;You can look at the propaganda on a lot of the terrorists sites and what Donald Trump saysabout Muslims is used to recruit fighters.
0;Says Chris Christie was the first governor in America to endorse Mitt Romney.
0.5;General Electric hasnt really created any jobs in this country doesnt pay any taxes and theyre making historic profits.
0.75;Says the U.S. Attorneys Office said that neither I nor my campaign had any idea what was going on regarding my fathers illegal campaign contributions. And thats why they closed this case.
0.5;Iowas Republican caucus stopped mattering years ago. It in no way determines the party nominee.
0.25;Says both Donald Trump and Hillary Clinton say Planned Parenthood is terrificand that it should keep taxpayer funding.
1;In 2008 then-Sen. Barack Obama missed 60 or 70 percent of his votes. In 2004 John Kerry missed close to 60 to 70 percent and Bob Graham missed over 30 percent of his votes.
0;Texans eat more catfish than residents of all other states combined.
0.5;Says Ted Cruz wanted to let in more Syrian refugees and give amnesty to illegal immigrants.
1;January through November 2014 the year so far were the hottest first 11 months of any year recorded.
0.5;[W]hen adjusted for cost of living Georgia ranks first nationally in teacher salary and benefits.
pants-fire;U.S. Sen. Sheldon Whitehouse rewarded Wall Street executives with millions in bonuses.
0.75;Says his Act 10 reforms have saved the taxpayers some $3 billion.
1;Says the federal health care law upheld by the Supreme Court has improved or saved the lives of more than 4000 Texans otherwise prevented from obtaining health coverage due to pre-existing conditions.
0.5;About 3 percent of Gov. Nathan Deals appointments have been African-American.
1;And as of today New Jersey state government has less employees than when Christie Whitman left office in 2001.
0.75;When I was born defense spending was 60 percent of the budget. Its now 17 percent.
0.75;John McCain saidin December he was surprised there was a subprime mortgage problem.
0.5;More lives are lost from violence against women sex-selective abortion female infanticide suicide egregious maternal mortality and other sex-linked causes than were lost during all of the wars and civil strife of the 20th century.
0.5;The benefits that were offered to me as a congressman dont even compare to the benefits that you get as a state employee. I just experienced that myself. Theyre not nearly as good.
0.5;Huckabee supported a tuition break to the children of illegals that are here illegally when citizens are having to pay a higher rate.
1;The Senate Republican education plan is an unfunded mandate for local school districts.
0.5;Obama voted for and even sponsored amendments that were intended to kill the (immigration overhaul) legislation.
0.25;With ObamacareYou have no options ..you cant get competitive bidding.
1;John McCain has said the economy is not his strong suit.
0.5;Weve seen highway fatalities actually decrease in Colorado since marijuana use was legalized.
0.5;I believe Senator Clinton youve raised more money from those people (the oil and gas industry) than any candidate Democrat or Republican.
0.5;Gov. Rick Scott is trying to get a waiver under the federal health care law that would deny consumers in Florida the right to the $60 million in rebates they have from their own HMOs.
0.75;Jason Carter actually opposed more funding for education in the Senate.
1;Every day in the United States we are losing 15 factories.
0.75;About 2 percent of Americans get paid the minimum wage.
0.75;The Affordable Care Act is a major reason why weve seen 50000 fewer preventable patient deaths in hospitals.
0.25;After Patrick Murphys charges were dropped Murphys father gave the prosecutor a huge campaign donation.
0;The current (agriculture) commissioner allowed tainted beef to be sent to school cafeterias.
1;Congressman John Lewis an American hero made allegations that Sarah Palin and I were somehow associated with  the worst chapter in American history.  And Senator Obama you didnt repudiate those remarks.
1;The national debt is equal to $48700 for every American or $128300 for every U.S. household. It is now equivalent to the size of our entire economy.
1;This week the House of Representatives voted to remove the word lunatic from federal law.
0.25;Less than 2 percent of illegals are picking crops but 41 percent are on welfare.
0;Says the states budget shortfall is not that much different than it was in 2003.
0.5;Sen. Joe Biden the ranking member of the Foreign Relations Committee recommended partitioning Iraq into three separate entities.
0;The overwhelming number of school districts reported their staff stayed the same or grew after the 2011-13 state budget
0.75;Seventy percent of Missourians support voter photo ID legislation.
0.75;Says middle-class New York State residents will have the lowest tax rate in 70 years.
0.5;My plan offers three times as much tax relief to the middle class as Senator McCains.
0;Thirty million Americans including a lot of people in Florida are going to be able to get healthcare next year because of that law.
0.75;Under President Obama domestic oil production is at an eight-year high.
0.5;Says under U.S. Sen. Robert Menendezs watch the nations unemployment rate and debt doubled and the federal budget deficit quadrupled.
0.25;Seniors will see $500 billion in Medicare cuts to fund Obamacare.
0;Theres only one candidate under investigation -- Terry McAuliffe.
0.75;Annual water usage in 2010 was actually down more than 18 percent from usage in 2006.
1;Currently there is no one from South Austin on the (Austin City) Council!
0.5;The percent of students who enter high school and eventually earn a diploma or equivalent or who remain in pursuit of a diploma or equivalent is 90 percent.
0;We have been focusing so much especially the Texas Department of Transportation on that 97 percent of people in single-occupancy vehicles.
0.75;There is no state in the U.S. where a 40-hour minimum wage work week is enough to afford a two-bedroom apartment.
0;When those restrictions expire (in the Iran nuclear deal) Iran will have an industrial-size military nuclear capability ready to go.
pants-fire;Says Hillary Clinton will receive her congressional salary until she dies and the Secret Service pays her mortgage.
0.75;Says theres no proven instance where hydraulic fracking has polluted groundwater.
1;Sixty percent of the auto thefts that we have in (St. Petersburg) are caused by people leaving their keys in the car.
0.75;Obamas secretary of energy Dr. Steven Chu has said publicly he wants us to pay European levels (for gasoline) and that would be $9 or $10 a gallon.
0.75;$100000 in stimulus funds (were) used for a Martini Bar and Brazilian Steakhouse.
1;Says if labor force participation rate were the same as when Barack Obama became president unemployment would be 11 percent.
0.5;"There are millions of women all across the country who rely on Planned Parenthood for not just contraceptive care; they rely on it for mammograms."
0.5;Under Obamas tax plan 95 percent of you will get a tax cut.
0.5;It is simply a fact that insufficient funding for Amtrak has delayed the installation of a positive train control safety system. To deny a connection between the (derailment in Philadelphia) and underfunding Amtrak is to deny reality.
0.75;Austin has over 1000 city employees that make six-figure salaries.
pants-fire;Every signer of the Declaration of Independence had no federal elected office experience.
0.25;The state [food stamp call center] program is administered from foreign shores.
0.5;Says the acting chief of the IRS said he and the majority of IRS employees would rather stay with his current health plan than switch to Obamacare.
0.75;Florida is now the No. 1 state in the country for automobile accident fraud.
0.25;When I took office last year we faced historic budget deficits of $6 billion here in Virginia. And we closed those deficits by cutting spending.
0.25;All University of Texas student-athletes get an iPad.
1;There was no surge in 501(c)(4) applications in 2010.
1;Says 10 days after Hurricane Katrina this chamber passed two separate bills amounting to $60 billion. It has been nearly two months since we had Superstorm Sandy and nothing has passed.
0;President Barack Obamas budget threatens national security by proposing an Army of fewer personnel than we had before Pearl Harbor.
1;The extra point is almost automatic. (The NFL) had five missed extra points this year out of 1200 some odd attempts.
0;Says that under his tax plan no matter where you are in the stratosphere youre going to be getting a tax cut.
0.75;We have a governor whos vetoed measures like increasing our minimum wage and restoring the earned income tax cut.
0.25;Says Milwaukee County buses are no less safe now than a year or two ago.
0.25;Says the average government worker wont be impacted in the first two years under the reform of state health benefits.
0.5;Says she voted for a statewide fracking ban.
pants-fire;Planned Parenthood is the only health care that a significant number of women get. About 30 percent of women thats their health care.
0.25;The federal limousine fleet has increased by 42 percent since Barack Obama took office.
0;Says Texas has been waiting for two years for the federal government to act on a proposal to allow the state to create insurance opportunities for those that are uninsured today.
0;Says he was endorsed by theValley News newspaper.
1;John McCain voted against funding the troops because of . . . a timeline in it to draw down American troops.
0;We had a massive landslide victory as you know in the Electoral College.
0.5;More people have been put on food stamps by Barack Obama than any president in American history.
0;A new bill was written into the new health care reform initiative ensuring that Congress will be 100 percent exempt.
0.25;Says President Barack Obama attacked potential terrorist targets in Syria in the middle of the night to minimize terrorist casualties.
0.75;Says Nevadans will have a double-digit hike in their Obamacare premiums for the year and 10 of Nevadas 16 counties will only have one Obamacareexchange insurer
0.5;If Rhode Island raises the meal and beverage tax to 10 percent it would be the fourth-highest in the nation.
0.5;Says the Austin chapter of the League of Women Voters has no Republicans among elected officers or on its debate committee.
1;Voting in the wrong precinct led to over 14000 registered voters statewide to lose their vote in 2008.
pants-fire;While CEOs of some large charities have big salaries the heads of some veterans groups do the job for free.
0.5;Says that according to a report the tech sector now drives more than one-quarter of Austins economy.
0;The form students fill out to get college financial aid is longer than the form to get U.S. citizenship.
1;In Harrisburg I passed more bills than all the Democrats combined in terms of legislation affecting the city.
pants-fire;Says Obama wants to give (Iran) nuclear weapons and Michael Bennet he was all for it.
1;This year Newt Gingrich has raised as much money as Mitt Romney Tim Pawlenty Sarah Palin and Mike Huckabee combined.
0.25;Over the last 40 years real wage growth has been flatlined because of the policies of the Federal Reserve  It was all driven by the Federal Reserve.
pants-fire;Seniors will have to find $12500 for health care because Republicans voted to end Medicare.
1;Says she has bipartisan support including 53 sheriffs throughout the state Democrats and Republicans.
0.5;Says Hillary Clinton has been given tens of millions of dollars by countries that treat women horribly and countries that kill gays.
0.25;President Obama promised families making less than $250000 a year would not see taxes go up but Obamacare raises 18 different taxes.
0.5;In Texas a faceless hospital panel can deny life-sustaining care giving you only 10 days to find another facility for your mother dad or young child even if the patient is conscious.
0.25;The polls show over half of Americans identify themselves as being pro-life.
1;One in four Texans lacks health insurance the highest proportion in the nation.
0;On repeal and replace of federal health care reform.
0.5;Under the Obama economy  utility bills are higher.
0;Our real unemployment is anywhere from 18 to 20 percent. Dont believe the 5.6. Dont believe it.
0;House Republicans just passed a bill that makes it legal for single mothers to be fired by their employers.
0.5;This president has offered fewer executive actions than almost any other president preceding his presidency in recent history.
pants-fire;Says Barack Obama and his team are socialists in every respect of the word.
0.25;The (Jackson) plan (for reforming Cleveland schools) lacks any data or methods proven to raise student achievement.
0.25;Under Scott Walkers policies the typical Wisconsin family has actually seen their real income drop by nearly $3000 in the last four years.
0.25;Says Ronald Reagan got the Saudis to flood the market with cheap oil.
0.25;Says. Rep. Joe Barton R-Texas once said Wind is a finite resource and harnessing it would slow the winds down which would cause the temperature to go up.
