0.75;George Bush sent people to war without body armor.
0.75;Says Jeff Brandes voted to allow state-run Citizens Property Insurance to dump policies onto out-of-state unregulated private companies.
0.25;Ch Guevara wrote extensively about the superiority of white Europeans over people of African descent.
0.75;From 1947 to 1979 family incomes for rich middle-income and poor Americans grew about the same rate. But since 1979 incomes for rich families have grown much faster.
pants-fire;Hitler abolished unions and thats what Wisconsin Gov. Scott Walker is doing today.
0;Says Ted Kennedy sent a letter to then Soviet leader Yuri Andropov apologizing for Ronald Reagan and begging the Soviets not to overreact.
pants-fire;Page 92 of the House health care bill says specifically that people cant purchase private health insurance after a date certain.
0.5;Republicans went out of the way to praise (Eric) Holders nomination.  Not a single Republican senator opposed Eric Holders nomination.
0.25;We actually have not required in this law that you carry health insurance.
pants-fire;States still face a mandate to expand Medicaid coverage under President Obamas health care reform law.
0.25;SaysTom Cotton voted against preparing America for pandemics like Ebola.
0.25;Since President Obama took full control of Washington every single day more than 1500 of our jobs have been lost.
pants-fire;Says Nancy Pelosi said Waiting long hours in the emergency room will allow you to make new friends!
0.75;The DREAM Act was written by members of both parties. When it came up for a vote a year and a half ago Republicans in Congress blocked it. The bill hadnt changed.  The only thing that had changed was politics.
0.25;Says former state Sen. Kelli Ward wanted to ban our intelligence agencies from operating in Arizona.
0.5;70000 three-year-olds and four-year-olds across America will lose access to the preschool Head Start program.  2000 in the state of Florida alone.
0.25;Betty Sutton and her fellow Democrats went on a spending spree and now their credit card is maxed out.
0;Muslims attempted to establish the first Islamic Sharia court inside the United States in the town of Irving Texas.
pants-fire;Since January 2008 the private sector has lost nearly 8 million jobs while local state and federal governments added 590000.
0.75;Of the 10000 Rhode Island children in charter school lotteries for the fall more than 70 percent are poor . In addition a majority of them are students of color.
0;Yes this would be the same congressman (Rep. Pete Hoekstra) who last year Tweeted the whereabouts of a top-secret mission to Iraq.
0.75;Says the federal government could save $175587 by eliminating a study of the connection between cocaine and risky sex habits of the Japanese quail.
0;On the Cuba embargo.
0;Says Scott Walker rejected legislation to make college loan payments tax deductible and the result was to raise taxes on students.
0.75;Obamas position on nuclear arms is a march toward global zero.
0.75;Once people become citizens under the DREAM Act and turn 21 they can sponsor their illegal immigrant parents for legalization.
0;Says Wisconsin Manufacturers Commerces own 2014 survey revealed that just 15 percent of business executive respondents were in favor of Right-To-Work legislation.
0.25;The Capitol Police force is going so far as to use paramilitary equipment in dealing with singing protesters in Madison
pants-fire;Tens of thousands of fraudulent Clinton votes found in Ohio warehouse.
0;When it comes to protesters in Madison almost all are now from outside of Wisconsin.
1;Says Democratic runoff opponent Grady Yarbrough twice previously ran statewide as a Republican.
0.5;Says U.S. Rep. John Barrow left taxpayers on the hook for $950k study on genetic makeup of ants.
0.75;President Obamas recent plan to cut $100 million of waste within his administration wont actually save money because hes going to spend it elsewhere.
1;The estimated savings of this (debt ceiling) deal only pay for half of the cost of extending all of the Bush-era tax cuts for another decade.
pants-fire;As Florida secretary of state Kurt Browning allowed 1800 illegal voters to register in Florida.
0.25;The only budget Ted Cruz ever voted for in his time in the Senate is a budget that cut defense spending by more than Barack Obama proposes we cut it.
0;Rural schools enroll 40 percent of American children but receive only 22 percent of federal education funding.
0.75;Based on the August 2012 national jobs numbers for every person who got a job nearly four people stopped looking for a job.
0;On repealing the 17th Amendment
0.5;More than 90 percent of the gains have gone to the top 1 percent.
pants-fire;An aide acted on his own and was not representing the Thompson campaign when he sent an email criticizing the sexual orientation of U.S. Senate candidate Tammy Baldwin.
0.75;On immigration what reports say President Barack Obama plans to do is roughly on the same scale as what President George H.W. Bush did.
0.5;Since 2013 alone the Obama administration has allowed 300000 criminal aliens to return back into United States communities. These are individuals encountered or identified by (Immigration and Customs Enforcement) but who were not detained or processed for deportation because it wouldnt have been politically correct.
0.75;Shirley Sherrod was forced to resign before anybody on Fox said a word about this.
0.5;That 3.5 percent (increase in the third quarter GDP) came from two things government spending on Cash for Clunkers they just moved fourth-quarter auto sales into the third quarter and the first-time home buyer thing.
0.25;Were $15 trillion now in debt with a president thats racked up as much debt as almost all of the other presidents combined.
1;Twenty-two million jobs were created during Clintons two terms but only 3 million during Bushs.
0.25;In the New York 9th District there is a large number of people who went to the polls tonight who didnt support the president to begin with and dont support Democrats -- and its nothing more than that.
1;A government shutdown could disrupt  veterans benefits.
1;A family of four can make up to $88000 a year and still get a subsidy for health insurance under the new federal health care law.
0.5;An economic impact study found that for every $1 invested in pre-K in Pennsylvania a total of $1.79 is generated in total spending within the state.
0.5;Last year it was discovered that Rhode Islands public employees ranked 4th in average pay while the private sector ranked 23rd.
0.25;Says Will Hurd said a border-long U.S.-Mexico wall absolutely makes sense.
1;Says state workers have not had across-the-board raises in six years.
1;When I was in college we used to take a popcorn popper . . . and we would fry squirrel.
1;Ronald Reagan raised taxes in 1982 1984 1985 1986 and 1987.
1;Says Sen. Rand Paul R-Ky. has stated that supporting the right to health care  means you believe in slavery.
0.25;Says Bernie Sanders health care plan would empower Republicangovernors to take away Medicaidto take away health insurance for low-income and middle-income working Americans.
pants-fire;In 2006 Planned Parenthood performed more prevention services and cancer screenings than abortions but in 2013 there were more abortions.
0.5;A proposed amendment allows a teenager to get a recommendation for medical marijuana without the consent of a parent.
0.25;Says nothing in Obamas $3.7 billion request to address the child immigrant situation actually secures the border.
1;Pregnant women trying to buy health insurance on their own are barred from maternity coverage because they have a pre-existing condition.
1;If youre earning under $100000 a year and you commute to New York every day you pay more to the Port Authority in tolls than you pay to the state of New Jersey in income tax.
0.5;In Chile they have 72 percent of the GDP in savings.
1;There are 850000 Ohio jobs tied to the auto industry.
pants-fire;The Mexican government forces many bad people into our country.
0.5;A sitting sheriff cannot be charged except by a warrant issued by a Superior Court judge.
0.75;Since 1999 all Virginia Lottery profits have been used for public education in the Commonwealth for kindergarten through 12th grade.
0.75;Says House Republicans rejected a straightforward measure that would prevent members of Congress and the president from being paid during a government shutdown.
0;Governor Christie also remains the only Governor since World War II among both Democrats and Republicans who failed to have his party win control of at least one legislative body over the course of his term.
0;Sixty-percent of the state retireesdont get Social Security.
pants-fire;Over 73% of all donations raised (from the ALS Ice Bucket Challenge) are going to fundraising overhead executive salaries and external donations.
1;If you go strictly by the numbers crime is down across the board. Last year we had a 10 percent decrease in the most serious crimes.
0.75;Sunday liquor sales could generate $3.4 million to $4.8 million a year in additional sales tax revenue for Georgia.
0.75;Says the 2010-11 New Hampshire budget ended with an $18 million surplus while the Republican-led 2012-13 budget has a $40 million deficit.
0.25;Says Barack Obama was silent on Iran when the students took to the streets in Tehran and the people there protested (and) the Green Revolution occurred.
0.75;No candidate has run more negative ads in American history than Barack Obama did in 2008 especially in the general.
pants-fire;Inner-city crime is reaching record levels.
0.75;The right-to-work states have much lower level of unemployment than the union states do.
0.25;Oklahomas Republican Gov. Mary Fallin signed a new law which makes you pay a special fee. It will essentially fine people for the crime of using solar power.
0;Tampa mayoral opponent Bob Buckhorn supported forcing police officers to keep their guns locked in the trunks of their cruisers.
0;Millions could lose their health care coverage and be forced into a government pool under the new health care law.
1;A Texas police department bought an ad telling drug dealers We can take your competition off the streets for FREE.
0;Only a few months ago the FBI arrested three Broward County Commissioners for accepting millions of dollars in trade for illegal favors.
0.25;Our unemployment rate has been higher than 8 percent for more than two-and-a-half years far above what the Obama Administration promised with the stimulus.
0.75;Thanks in part to our all-of-the-above strategy for American energy the United States generates more natural gas than anybody.
1;State law says that once the state appraises a piece of property they can only pay it a certain amount above appraisal.
pants-fire;Ted Cruz helps run two national organizations that have been leading the push to give amnesty to illegal immigrants.
0.75;Says Chris Christie created this new category where you could get laid off and just be totally denied unemployment benefits forever.
0.75;Thanks to our reforms the average family will have an extra $322 to spend.
1;Measles is one of the most common causes of child blindness worldwide.
1;When oil and gas prices sent state revenues up Palin sent a large share of that revenue directly back to the people of Alaska.
0.25;Says he was the only Republican candidate at a prior debate who said lower-income workers were being hurt by the economy.
0.75;Says Hillary Clintons top 10 donors are mainly banks corporations and media while Bernie Sanders top 10 donors are labor unions.
0;Portland Community College serves more students than all of the states universities combined.
0.5;If we dont spend money on a pier then that money does wipe into the general funds of the city or the county and if you send it to the county you never see it again.
pants-fire;Obamacare is . . . the largest tax increase in the history of the world.
0.75;Republican candidate for governor Allan Fung donated to Democrats like Congressman David Cicilline disgraced (House) speaker Gordon Fox and even Mr. Obamacare Harry Reid.
pants-fire;Says Barack Obama founded ISIS. I would say the co-founder would be crooked Hillary Clinton.
0.75;More than 70000 job openings are listed on a state jobs website.
1;When the United States invaded Iraq Saddam Hussein wanted to acquire weapons of mass destruction and he said so himself after his capture.
0.25;When asked about bills in Congress important to the North Country Derrick responded I just dont know enough about it.
pants-fire;Except for Virginia the other 49 states keep raising their gas tax.
0.25;Says 70000 children have lost their Head Start slots because of the sequester.
0;On disaster aid offsets
0.75;(Strickland) raised taxes last year to the tune of $840 million.
0;Sarah Palin has more experience than Barack Obama.
0.5;A golf course closes somewhere in America every 48 hours.
1;If you rent a U-Haul to move your company it costs twice as much to go from San Francisco to Austin than the other way around because you cant find enough trucks to flee the Golden State.
0;The Congressional Budget Office has already doubled its estimate for the cost (of Obamacare) so far from roughly $800 billion to $1.7 trillion.
0;Oregons three largest employers and 13 of the top 25 are health care providers.
0.25;We get 30 percent of our oil from the Gulf (of Mexico).
0;The Department of Energys Billion Ton Study has shown that wind and solar energy combined could at best provide only 5 percent of our total energy needs.
1;Says the U.S. Constitution provides for just compensation when land is taken under eminent domain.
0;Says Mitt Romneys campaign has already spent more on negative ads than John McCain did during his entire presidential run.
0;As we near the 10th anniversary of the 9/11 terrorist attacks we should not forget that some of the hijackers used New Jersey drivers licenses to board those aircraft.
1;For every $10000 invested in business incubators up to nearly 70 local jobs are generated.
pants-fire;Although the governor doubled the beach fees . . . all the money as we found out is all going to an out-of-state company. The state isnt even getting the money for that.
0;Three presidents in the last century Harding Kennedy and Reagan all cut taxes during recessions and produced rapid and dramatic economic recoveries while two Herbert Hoover and Barack Obama did the opposite.
0.5;The Congressional Budget Office analysis of the health insurance reform legislation says the bill cuts the deficit by $1.2 trillion in the second 10 years.
0.25;Says John Barrow voted with Obama 85 percent of the time.
0.5;Studies show that people that are on welfare are higher users of drugs than people not on welfare.
1;The income of the top 1 percent nearly quadrupled from 1979 to 2007 but the typical familys incomes barely budged.
1;John McCain has voted with George Bush 90 percent of the time.
0.75;Says he and Bernie Sanders have very similar views on trade
0.5;On (Rob Portmans) watch as Bushs trade czar our deficit with China exploded and as Bushs budget chief Portman oversaw a spending spree that doubled the deficit.
pants-fire;Sens. Mark Warner and Tim Kaine voted to let the U.N. take OUR guns.
0.25;In just six years Georgia has dropped from first in the nation from a business-friendly legal climate to 24th.
0.5;6.4 million more Americans living in poverty under President Obama.
0.5;Hillary Clinton is willing to have workers wages garnisheed if they refuse to buy health insurance.
0.5;We have less crime in the (Rio Grande) Valley than we do in other major Texas cities.
0;Says In the last four years weve cut $36 million in ongoing revenue.
1;Financial conflict-of-interest laws dont apply to the president right? So the president doesnt have to have a blind trust.
0.25;Says nearly 1 million people are coming to town in the next 20 years.
0.5;The House health care bill pays for about six years of program with a decade of revenue with the heaviest costs concentrated in the second five years.
0;Its just outrageous that under President Bush the National Institutes of Health have been basically decreased in funding.
0;Kathryn Starkey joined forces with liberal Democrats on a historic sales tax hike.
0.5;Prices are going up. Unemployment is continuing to go up.
0.25;Says Texas has the nations most uninsured residents.
0.75;We are 49th in the nation for our graduation rate
0.75;Welcome to #Houston the most #diverse city in #America.
0.25;The White House has three staff calligraphers making between $86000 and $97000 each and just one National Security Director. She makes $55000.
0;Says Maggie Hassan is the only female governor in the country.
0;Thomas Paine wrote that the duty of a patriot is to protect his country from his government.
0.75;Weve dedicated more money from (Washington Countys) transportation budget to bike and ped projects under my watch than at any time in the history of Washington County.
1;The radiation coming from the new TSA body scanners is equivalent to about three minutes worth of air travel by anybody say at 30000 feet.
0.25;If Fox News presidential debate rules had been in place during the1992 electionBill Clinton wouldnt have beenon the stage.
0;U.S. Senate candidate Todd Akin was partly right that a womans body has a way of shutting down so that a pregnancy doesnt occur if shes raped.
0.75;The American Academy of Pediatrics supports banning guns.
0.25;Barbara Boxer voted to cut spending on Medicare benefits by $500 billion cuts so costly to hospitals and nursing homes that they could stop taking Medicare altogether.
pants-fire;Global warming is a hoax.
0.25;Says that we brought CHI Manufacturing that had business in China back to Texas.
0.75;This year the Blackstone Valley Mayoral Academy became the first public school in Rhode Island history to have 100 percent of its elementary-age students proficient in reading on state assessments.
0.25;The cap-and-trade bill will mean 2 million jobs lost.
0;The new health care law crushes small businesses with billions in penalties.
0;"The fact is that although we have had a president who is opposed to abortion over the last eight years abortions have not gone down.	abortion	barack-obama	President	Illinois	democrat	70	71	160	163	9	a TV interview with megachurch pastor Rick Warren in Lake Forest Calif."
1;Most of the jobs that we lost were lost before the economic policies we put in place had any effect.
0.75;Europe and U.S. households waste 15 times more food than a person in Africa.
0.25;Says of a failed cloture vote on nominating Chuck Hagel for defense secretary: This is not a filibuster.
1;Says every school will be negatively impacted if Education Stability Fund is not tapped.
0.5;Virginia ranked 35th in job creation in 2009 under Gov. Tim Kaine and moved up to third for 2010 while McDonnell has been in office.
0;I was the first member of Congress to call him (Barack Obama) a socialist
0.5;Part of the increase in the cost (of higher education) has been because state support has dropped. We now spend under Governor Walker more on corrections than we do on higher education.
1;We send a billion dollars to foreign countries every day because of our addiction to foreign oil.
0.5;Since I came into office we have increased the VA budget by 85 percent.
0.5;Sotomayor thinks that ones sex race and ethnicity ought to affect the decisions one renders from the bench.
0;South Korea doesnt pay the United States for U.S. troops that protect their country.
0.75;While in the Illinois Senate Barack Obama passed tax cuts for hard-working families.
0.5;Every one of the mass shootings except two in America since 1950 have been in gun-free zones.
0;Says U.S. is giving seven Alaskan islands to Russia.
0.25;Says Rick Scott raised property taxes.
0.5;Mitt Romney said we should let foreclosures hit the bottom.
1;Says the military accounts for about 10 percent of Floridas economy.
0.25;Theres a section in the Constitution called the Emoluments Clause that says no one nor their spouses can take money from foreigners. (Hillary Clinton) has to be guilty of 70 or 100 counts just on that one charge.
0.5;The woman named Wisconsins 2010 outstanding teacher of the year was laid off by the Milwaukee Public Schools that year under seniority and tenure rules that were eliminated by his Act 10 changes.
0;Medicaid expansion could cost the Commonwealth of Virginia over $1 billion a year
0;The Islamic State is so small it couldnt fill a DoubleAballpark in Charleston W. Va.
0;There is no evidence that poor people abuse drugs more frequently than any other socio-economic group.
1;Wisconsin is #1 in the Midwest for personal income growth over the year.
0;The Democrats health care bills would provide free health care for illegal immigrants.
0;[If] you apply for a job the chances are 1 in 7 that you are going to be denied that job unfairly if everybody is forced to use E-Verify.
1;Some politicians want to put new taxes on a lot of groceries.
0;Says she never received nor sent any material that was marked classified on her private email server whilesecretary of state.
0.5;The United States won every major battle of the Vietnam War. Every single one.
0;When I was growing up as a kid in the city of Milwaukee if we averaged 4 homicides a year in the entire city that was a record number.
0.25;Says gas costs $4.50 a gallon.
1;My opponent on day one of this campaign attacked me on Medicare and Medicare Advantage and that claim was found to be False.
0.5;Al Franken said almost exactly what Trump said about John McCains military record.
0.5;Veterans unemployment is actually now lower than (the) general population. It was higher when I came into office.
pants-fire;In recent years Rep. LaTourette has sponsored legislation that would increase spending by 551.6 percent.
0;Some city of Atlanta employees have not had raises in eight years.
0.75;Republicans approved 12 times larger tax breaks for people making over 350 grand than for the average middle-class person.
pants-fire;99% of NJ voters do NOT support hunting.
0.75;Forty aides who serve President Barack Obama owe $333485 in back taxes.
0;Says U.S. Senate candidate Tommy Thompson admitted that Washington D.C. changed him into an insider selling his influence to make millions from powerful special interests.
0.75;Factories are opening their doors at the fastest pace in almost two decades.
0.25;In New York City murders are up.
0.75;Obama has asked for $932-million in earmarks literally $1-million for every day that hes been in Congress.
0.75;Says Ronald Reagan repeatedly talked about how irresponsible it would be to allow the full faith and credit of the United States to be impaired in any kind of way.
0.5;We cut a record $15 billion from our state budget.
0;Now we have ISIS coming over the (U.S.-Mexico) border.
0;For every single scientist that tells you (global warming is) happening and that its our faultI can stack up another group of reports that say just the opposite.
0.5;Says 94 percent of Wisconsin employers think the state is heading in the right direction and a majority say they will grow their companies in 2012.
0.25;Says Hillary Clintons plan is going to raise taxes and even double your taxes.
0;Millions of Americans are paying more and getting less under Obamacare.
0;When he took office in 2009 President Barack Obama had the biggest Democratic majorities in Congress since Lyndon Johnson.
0.25;Sen. McCains economic plan gives nearly $4-billion in tax breaks to the oil companies but doesnt provide any tax relief to more than 100-million middle-class families.
0;Says Barack Obama is getting his nominees confirmed faster than President (George W.) Bush was at the same time in his second term.
1;Says Obama promised to cut the deficit in half.
1;In 2009 Democratic Wisconsin state senators rammed through a billion-dollar tax hike in 24 hours with no public input.
1;90% of Americans want national background checks that close loopholes.
0;Dozens of artists including Justin Timberlake Jay Z and Rihanna are canceling Florida shows like Stevie Wonder in protest of stand your ground.
0.25;We have that program where immigrants come here and they have to bring a million dollars in order to get a green card if theyre going to create jobs.
1;Says Newt Gingrichs contract was with the lobbyists at Freddie Mac.
0.25;Privatizing Social Security was a bad idea when George W. Bush proposed it. Its a bad idea today. Sen. McCains campaign went even further  suggesting  to cut cost-of-living adjustments or to raise the retirement age.
1;On deporting illegal immigrants.
0;The countrys bankrupt.
0.5;We spend a staggering amount of money on health care over $2-trillion and almost twice as much as any other country per person.
0;Preventive care saves money.
0;Says Connie Mack IV co-sponsored a bill to take a third of the Social Security Trust Fund  give it in individual accounts to the senior citizens who then were to invest it in the stock market.
0;Our National Guard as we saw in the Midwest flooding cant function as effectively as it could. I was talking to National Guard representatives. Fifteen of their 17 helicopters in this region were overseas during the flooding.
1;Fulton County has successfully reduced the number of pregnancies among 15- to 19-year-olds.
0.5;Says the Texas House has a record number of new members joining our ranks.
0;Says Democrats cut $35 million from the state budget for Information Technology improvements.
0;Austins Pease Elementary is a school that was created as part of the Texas Constitution.
0;I was pretty proud of being the only guy on the stage that ever had a job in the private sector.
0.5;The 30 percent tax rate called for under President Barack Obamas proposed Buffett Rule is lower than the prescribed tax rate for millionaires already -- not just for millionaires for people making over $200000.
