text;grand_truth;calculated;dif;found phrases;out of
Atlanta is the No. 1 trading point for sexual slavery in America. Between 100 and 200 girls are sold into slavery in Atlanta every month;0.5;0.36584593487774497;0.13415406512225503;14;24
According to a national survey transit ridership among people age 16 to 34 increased 40 percent between 2001 and 2009;0.5;0.4919858066064685;0.008014193393531488;9;19
In fiscal year 2011-2012 4191 abortions were paid for by taxpayers via the Oregon Health Plan;1;0.6649595795966294;0.33504042040337056;9;15
Any legislative action that is taken now could very well be rendered completely null and void by the decision of the Supreme Court expected this June;0;0.5723965674717253;-0.5723965674717253;11;25
Im the only Republicancandidate that has actually reduced the size of government;0.5;0.4508884460020537;0.04911155399794631;9;11
After how hard you work and how much you pay in taxes New York City ends up getting the money. Im Chris Jacobs. I think its time we have someone in Albany thats making sure our region gets our fair shar;0;0.4165950155158643;-0.4165950155158643;19;40
Amazing fact: Senate has already voted on more amendments in 2015 than Reid allowed ALL YEAR last year;0.75;0.3906270498217309;0.3593729501782691;10;17
Says state Supreme Court candidate Joe Donald twice supported incumbent Justice Rebecca Bradley;0.75;0.4500301498163721;0.2999698501836279;5;12
One out of every four students fails to earn a high school diploma. In our major cities across America half of our kids dont graduate;0.75;0.45187102604067997;0.29812897395932003;16;24
There were 36 states where Republicans who were in charge refused to implement a state health insurance exchange;0.25;0.44251906682892683;-0.19251906682892683;13;17
Says a tweet he sent out wasnt saying check out a sex tape. It was just take a look at the background of Alicia Machado;0;0.402570055697697;-0.402570055697697;9;24
Aphotograph of 21-year-old Hillary Clinton featured a Confederate battle flag in the background;0;0.378133713555347;-0.378133713555347;5;12
Texas leads the nation in the percentage of residents without health insurance;1;0.45574449123503114;0.5442555087649689;10;11
This administration and this Congress have been systematically cutting funding to border security since the Democrats took control;0;0.34414326552810603;-0.34414326552810603;10;17
A new college tuition reciprocity agreement with Minnesota makes college education more affordable for Wisconsin residents;0;0.46658352161498107;-0.46658352161498107;8;15
Says Cory Booker supports late-term and partial-birth abortion and opposes safety regulations;0.5;0.5820243160471623;-0.08202431604716232;2;11
Mitt Romney is the first major party candidate for president of the United States in modern times not to release at least 12 years of tax returns;0;0.4104452225662242;-0.4104452225662242;24;26
In the month of July alone EU exports to South Korea increased by over 36 percent. A lot of that is our market share. Those are our farmers and our service providers who are suffering;0.5;0.388911988316723;0.11108801168327698;17;34
Gov. Rick Perry spent over a million dollars on D.C. lobbyists asking for more federal money and lives in a luxury house that costs taxpayers $10000 a month;0.75;0.40833679016086766;0.34166320983913234;20;27
As Virginia lost over 65000 jobs Tim Kaine put partisan ambitions first by serving as DNC chairman during the last year of his governorship;0.5;0.4286771678115052;0.07132283218849478;10;23
The DNC says McCain flip-flopped on whether the Iraq War would be easy;0.5;0.3665461249216848;0.1334538750783152;8;12
Says Ohio law gives tax breaks to rich people who own private jets;0.75;0.40660775869270704;0.34339224130729296;6;12
Says Zack Space voted for budgets and debt energy taxes and the stimulus and we still lost more than 2.5 million jobs;0.5;0.5513782006428589;-0.05137820064285892;13;21
Says Paul Ryans budget plan ends Medicare;0;0.46284834525329266;-0.46284834525329266;5;6
In every ethics case that has resulted in a formal sanction theres been an investigative subcommittee thats been established first;0.5;0.1720121632465864;0.3279878367534136;8;19
Says New Hampshire has the third-highest property tax in the country;1;0.4435412601808242;0.5564587398191758;8;10
Obamas tax plan cuts taxes for 95 percent of all working families;1;0.5657103352556043;0.4342896647443957;10;11
Says Colorado Democraticcongressional candidate MorganCarroll racked up $11 billion in new spending in the state Legislature;0.25;0.2781834257909044;-0.02818342579090438;8;15
59 percent of Americans today believe that Barack Obama is still a Muslim;0;0.2307064029169521;-0.2307064029169521;10;12
Carol Shea-Porter wants to increase taxes on small business and job creators;0;0.313636219898633;-0.313636219898633;10;11
People were hopeless. Sixty percent of the population 70 percent of the population wanted to live somewhere else. By the time I left 70 percent wanted to stay;0.25;0.4611845811228852;-0.21118458112288518;18;27
A bill delaying the start of classes until Labor Day would permit school districts to shave 5 full weeks off the school year;1;0.3186886477525509;0.6813113522474491;8;22
On whether the United States should intervene in Libya;0;0.39836277356212235;-0.39836277356212235;6;8
99.97 percent of the kids live in poverty that attend Cleveland public schools;0.5;0.5392869323613645;-0.03928693236136449;7;12
John Kitzhaber created 128000 new jobs while governor;0.5;0.3952812516912555;0.1047187483087445;3;7
Says Texas ranks 49th nationally in what we are doing to support our per-pupil investment in education in the state;0.75;0.5069407072985064;0.24305929270149362;13;19
Despite keeping distance from national media interviewers I did local press all along the last three months;0.25;0.4130253856698741;-0.16302538566987412;6;16
What we said was you can keep your plan if it hasnt changed since the law passed;0;0.3836153793540147;-0.3836153793540147;14;16
In 2006 Bernie Sanders voted in the House with hard-line Republicans for indefinite detention for undocumented immigrants and then he sided with those Republicans to stand with vigilantes known as Minutemen who were taking up outposts along the border to hunt down immigrants;0.75;0.3885589286636545;0.3614410713363455;24;42
Says Florida didnt offer special incentives to Deutsche Bank which announced it will add 300 jobs in Florida;0;0.24855567536030376;-0.24855567536030376;5;17
Says she was the first in her family to go to a four-year college;0;0.48190006882439496;-0.48190006882439496;12;13
There was a Gallup poll in Egypt last year and 70 percent of Egyptians dont want our money;1;0.4315516385039415;0.5684483614960585;13;17
The truth of the matter is that during my administration the FBIs crime statistics show that violent crime was reduced in Massachusetts by 7 percent;1;0.42422728477760996;0.57577271522239;16;24
Scott Maddox has run losing campaigns for 3 of Floridas 4 available cabinet positions;0;0.5613784761723584;-0.5613784761723584;3;13
Americans spend 6.1 billion hours a year on tax preparation;1;0.4812876726923273;0.5187123273076727;7;9
The budget I managed at the Department of Education was more than $60 million;0.75;0.54733929644242;0.20266070355758004;9;13
We are now for the first time ever energy independent;0;0.4358616526199245;-0.4358616526199245;7;9
Last year Exxon pocketed nearly $4.7 million every hour;1;0.4199200464493905;0.5800799535506095;3;8
AARP is the largest reseller of insurance in the country and has a vested interest in seeing that the market for reselling supplemental insurance expands;0.5;0.4504764253094913;0.04952357469050872;13;24
Medicare monthly premiums will go up to $104.20 in 2012 and $247.00 in 2014 due to provisions incorporated in the Obamacare legislation purposely delayed so as not to confuse the 2012 re-election campaigns;0;0.2974272299049985;-0.2974272299049985;13;32
Right now 50 percent of Florida students leaving high school cannot read at grade level;0.75;0.4630998723392271;0.2869001276607729;9;14
Says Republican Sen. John McCain won more votes for president in Cuyahoga County in the 2008 general election than he did in seven states;1;0.44513543875439787;0.5548645612456021;20;23
Marco Rubio voted against funding health clinics that provide critical care during this public health emergency Zika;0.25;0.4508884460020537;-0.2008884460020537;9;16
Youre in more trouble if you leave your pet in the car than if you leave your child in the car;0.5;0.4361085003346148;0.06389149966538521;9;20
Says Peter Kilmartin voted in favor of expanding the good behavior statute to sex offenders;0;0.2430589442921911;-0.2430589442921911;9;14
On letting Occupy Atlanta protesters stay in Woodruff Park;1;1.0;0.0;1;8
What I have put forward does not add a penny to the debt;0.5;0.3676469469900506;0.13235305300994937;10;12
There are more African American men in prison jail on probation or parole than were enslaved in 1850;1;0.4727678796226463;0.5272321203773537;7;17
In first week as governor Tim Kaine proposed a nearly $4 billion tax increase $4 billion including a tax increase on people earning as little as $17000 a year;0.75;0.3548268711431317;0.3951731288568683;21;28
On Lee Fishers watch almost nine out of 10 jobs that Ohio lost were lost to other states not to other countries;0.75;0.44792482646164067;0.30207517353835933;14;21
Every president has raised the debt ceiling;0.75;0.4866828820923583;0.2633171179076417;6;6
Limiting labor negotiations to only wages is how it is for the most part in the private sector;0;0.4270287126336848;-0.4270287126336848;12;17
Says on contraception his plan is cheaper and easier for you than Sen. Mark Udall;0.25;0.22118095903541246;0.02881904096458754;8;14
The states have always defined marriage;0.5;0.42064711246626374;0.07935288753373626;3;5
Families in Del Valle who are City of Austin residents have to drive to Bastrop to go to the closest grocery store;0;0.46736674857844085;-0.46736674857844085;12;21
John McCain opposed legislation to fund levees and flood control programs which he considers pork;0.5;0.48748960643398753;0.012510393566012468;5;14
Mitt Romneys pledged to protect oil companies record profits and their billions in special tax breaks too;0.5;0.30213844839366366;0.19786155160633634;10;16
Mark Warner voted for nearly $1 trillion in new taxes and $7 trillion in new debt;1;0.4177288839027832;0.5822711160972168;13;15
State government spending will be increase 10.7 percent this year;0.25;0.28619809440942523;-0.03619809440942523;5;9
Says Democrats first proposed prohibiting the government from negotiating prices for prescription drugs in Medicare Part D and he had nothing to do with that provision in the law;0.25;0.3844154359502576;-0.13441543595025762;20;28
The FCCs net neutrality policy includes whatis essentially a massive tax increase;0.5;0.25139252155548386;0.24860747844451614;4;11
The typical white male worker in this country is making in real terms what he was making in 1973 and the average worker is making what they were making in 1996;0.75;0.38070886045496943;0.36929113954503057;20;30
A United Nations arms treaty would almost certainly force the U.S. to create an international gun registry setting the stage for full-scale gun confiscation;0;0.22098545739697284;-0.22098545739697284;11;23
More people die from medical misadventures than firearm accidents nationally and in Florida;0.75;0.45925105408125544;0.29074894591874456;5;12
When we took office let me remind you there was virtually no international pressure on Iran;0;0.353441995391351;-0.353441995391351;7;15
The minimum wage is mostly an entry-level wage for young people;0.75;0.3045101170498862;0.4454898829501138;6;10
Says six studies verify that the math adds up for Mitt Romneys tax plan;0.25;0.4617086938125188;-0.21170869381251878;9;13
In the United States weve had 12 years in a row of wages declining;0.5;0.58760052746924;-0.08760052746923996;9;13
Charlie Crist has six different positions on ObamaCare;0.5;0.45925105408125544;0.04074894591874456;5;7
In the last few months alone we have apprehended extremists within our borders who were sent here from the border region of Afghanistan and Pakistan to commit new acts of terror;0.75;0.4584332364664032;0.2915667635335968;17;30
As governor Ive stood up to the big oil companies;1;0.5088774829720237;0.49112251702797627;7;9
This year were off to our best private-sector jobs growth since 1999;0.75;0.6335479411895159;0.11645205881048415;7;11
Says abortion doctors are flying into this state performing abortions and flying out;0;0.49870409407307825;-0.49870409407307825;4;12
Speaker Gingrich for 20 years supported a federal individual mandate for health insurance;0.75;0.4435412601808242;0.3064587398191758;8;12
There have been at least 100 shootings each year Angel Taveras has been mayor of Providence;0.75;0.4488667717563818;0.3011332282436182;10;15
Maurice Ferre says Kendrick Meek has voted 98.6 percent of the time with the Democrat party;1;0.5686723815098591;0.4313276184901409;8;15
Weve created more jobs in the United States than every other advanced economy combined since I came into office;0.5;0.42329186867391466;0.07670813132608534;15;18
One in four inmates is an illegal immigrant;0.25;0.378133713555347;-0.12813371355534697;5;7
Wisconsin is dead last in income growth among midwestern states during Gov. Scott Walkers term;1;0.47529889997002883;0.5247011000299712;8;14
A three-cents-per-ounce soda tax in Philadelphia would result in the loss of 2000 family-sustaining Teamster Union jobs and countless other jobs in the beverage industry;0;0.4753387569761778;-0.4753387569761778;10;24
I have had the challenge during this administration to suspend no less than 37 public officials in about 36 months;0.75;0.34681675513046173;0.40318324486953827;13;19
Kendrick Meek was 1 in Florida in taking tobacco cash and then opposed a tax on cigars that would have helped pay for childrens health care;0.25;0.3321431131936239;-0.08214311319362388;16;25
Federal Reserve policies have led to a 69 percent rise in corn prices 44 percent rise in wheat prices and 15 percent spike in sugar prices over the last year;0.25;0.4373330580201471;-0.1873330580201471;14;29
On repeal of Wisconsins smoking ban;0;0.20890469516058519;-0.20890469516058519;3;5
Ninety percent of Texans say they do not want the nursing homes to close. It polls higher than anything else;0.75;0.4634668007771553;0.2865331992228447;12;19
For the first time ever we completely funded the critical needs waiting list so persons with unique abilities can get the help they need;0.5;0.40605559372964284;0.09394440627035716;10;23
Paul Ryan got his start in politics as a young staffer just out of college working for then-Congressman John Kasichs Budget Committee;0.5;0.43661343443095;0.06338656556904998;10;21
Race to the Top grants require participating states to adopt the Common Core standards as a condition for receiving federal funding;0.25;0.356975925204131;-0.10697592520413102;10;20
President Obama in November of last year wiped away a program that allows for shared fingerprinting for those who are behind bars so you know who is here legally and illegally;0.5;0.4306709596666052;0.06932904033339482;21;30
McCain sought the political support of minister John Hagee who believes Hurricane Katrina was Gods punishment for gay rights and called the Catholic Church the Antichrist and a false cult;1;0.31010199466931476;0.6898980053306852;10;29
Says 51 percent of federal tax filers paid zero federal income tax;1;0.3561417145178164;0.6438582854821836;8;11
Because of the 2011 debt ceiling fight the stock market lost 2000 points;0.75;0.2879134535838499;0.4620865464161501;6;12
Since Wisconsin Gov. Scott Walker took office we are losing jobs at rates not seen in decades;0;0.29563469624632943;-0.29563469624632943;12;16
Says U.S. Senate rival Tammy Baldwin supports a tax increase that President Obama says would cost middle-class families $3000 per year;0.25;0.3244737712218023;-0.07447377122180232;16;20
I would be the first Republican senator elected in New Jersey in 41 years;1;0.4965666307014369;0.5034333692985631;9;13
Wisconsins attorney general and state treasurer ordered the daughter of Earth Day founder Gaylord Nelson not to discuss climate change on state time;1;0.3134058274240574;0.6865941725759426;8;22
Says unions take away hard-earned money of teachers firefighters and police officers to play politics;0;0.32489626396498295;-0.32489626396498295;9;14
President Bush never did one interview with the New York Times during his entire presidency;0;0.355403660338351;-0.355403660338351;10;14
14000 Americans lose their health insurance every single day;0.75;0.42691290170567964;0.32308709829432036;6;8
Mr. Trump is self-financing his campaign so we dont have any donors;0;0.40660775869270704;-0.40660775869270704;6;11
Nearly 2000 high schools - roughly 12 percent of all secondary schools in the United States - produce about half of the nations dropouts;1;0.4814481281230417;0.5185518718769583;12;23
Embryonic stem cell research is at a dead end with no one good example of a successful treatment;0.25;0.5063190828729923;-0.2563190828729923;11;17
The U.S. spends more money on its military than the 16 biggest military budgets in the world combined;0.5;0.4941885141915302;0.005811485808469796;13;17
Wisconsin has only one county Dane thats hand counting the votes in the 2016 presidential recount;0;0.17619421481999897;-0.17619421481999897;10;15
Says Libya Ambassador Christopher Stevens sent 600 requests for help in Benghazi;0.25;0.36350841813191603;-0.11350841813191603;3;11
The Affordable Care Act is bringing the cost of health care in our country down;0.5;0.3592885274924218;0.1407114725075782;12;14
Tens of thousands of Atlanta households pay more than 30 percent of their income towards rent;1;0.5336732860717865;0.46632671392821345;11;15
Rick Perry had planned to retire from the legislature until his best friend David Weeks and I talked him into switching parties and running for the GOP nomination for agriculture commissioner;0.75;0.30315444181895057;0.44684555818104943;15;30
As the usage of synthetic marijuana has dramatically increased instances of violence bodily harm and even death have risen with it;0.75;0.4838758157139337;0.2661241842860663;6;20
Out of 150000 tenured teachers in the last 10 years only 17 have been dismissed for incompetence;0.75;0.5222712688069604;0.2277287311930396;8;16
The Providence teacher contract is one of the longest in the country;0;0.5418217973547312;-0.5418217973547312;8;11
In 1929 the Secretary of State shut down a program that was collecting information to protect America because it was unseemly but that move led to millions and millions of deaths in World War II;0.5;0.3149568168227517;0.18504318317724833;23;34
Look at the debt that has been accumulated in the last two years. Its more debt under this president than all those other presidents combined;0;0.46578027074440453;-0.46578027074440453;20;24
The Chris Hani Baragwanath in South Africa is the worlds third-biggest hospital;0.5;0.5978822153300285;-0.0978822153300285;5;11
Annual precipitation has increased in Rhode Island by over 12 inches in the last century;1;0.46784777867905236;0.5321522213209476;10;14
Says Connie Mack initially said he would have voted yes for the Paul Ryan budget plan and then you said it was stupid and you would vote no. And then your folks corrected you and you changed your position again yes;0.5;0.4157910907777125;0.08420890922228752;23;40
The state budget proposal has been submitted on time and its the earliest that a governor has done so in over two decades;1;0.3592262467387404;0.6407737532612596;18;22
Ohio is not meeting its obligation to update voter registrations when voters change their address with the BMV;1;0.3154117914495984;0.6845882085504016;6;17
Vietnamese is the third most commonly spoken language in Texas;1;0.45925105408125544;0.5407489459187446;5;9
What we have now is the most generous in my opinion good time bill in the entire United States;0;0.5651131191693325;-0.5651131191693325;14;18
There is no Plan B if the transportation referendum is not passed by voters;0.25;0.28988811239644985;-0.03988811239644985;7;13
Barack Obama wrote a thesis at Columbia University in which he criticized plutocratic thugs and said the Constitution gave Americans the shackles of hypocrisy;0;0.4145244725508601;-0.4145244725508601;10;23
Youll find blacks in almost every regiment throughout the South who fought right alongside white Southerners during the Civil War;0;0.4050235209235328;-0.4050235209235328;8;19
The most likely triggering cause of microcephaly is the DTaP shot a vaccine that had been recently mandated by the Brazilian government to be injected into pregnant women;0;0.34097772459614784;-0.34097772459614784;12;27
Our economy still has three people looking for every job opening;1;0.4640235175952254;0.5359764824047746;6;10
Says she got unions to agree to about $10 million in reduction of salaries and health benefits while serving as Dane County executive in Wisconsin;1;0.36485074078285584;0.6351492592171442;15;24
Democrats have lost more than 900 state legislators since Barack Obama has been president;1;0.4145244725508601;0.5854755274491399;10;13
Carly Fiorina shes against banning assault weapons;0.75;0.5820243160471623;0.16797568395283768;2;6
Hillarys baby bond proposal would give $5000 to each of the 4-million babies born in the U.S. each year totaling $20-billion per year multiplied by four years = $80-billion;0;0.30818820866519214;-0.30818820866519214;16;28
Says her campaign platform includes the biggest investment in new good-paying jobs since World War II;0.5;0.410049729450773;0.089950270549227;10;15
Joe Biden brought Republicans and Democrats together to pass the 1994 crime bill putting 100000 cops on the streets and starting an eight-year drop in crime across the country;0.5;0.39770597517619033;0.10229402482380967;18;28
If Rhode Island does a hybrid retirement plan well be the first state in the nation to do this;0;0.5073423798498968;-0.5073423798498968;13;18
Before the terrorist attacks in Benghazi the State Department not only failed to honor repeated requests for additional security but instead actually reduced security in Libya;1;0.26123544150080247;0.7387645584991975;16;25
Failure to raise the debt limit does not force a U.S. default on debt payments;1;0.45557001463231095;0.544429985367689;7;14
Democrats in the Legislature in 2009 voted for various pork projects including a $5 million scoreboard for the Milwaukee Bucks;0;0.48190006882439496;-0.48190006882439496;12;19
Says Donald Trump has defended World War II internment camps;0.5;0.6175173703372274;-0.11751737033722742;6;9
Bill McCollum holds the same position on embryonic stem cell research as Barack Obama;0.75;0.3750635288353672;0.3749364711646328;10;13
In 1999 the NRA leadership in Washington pretty much the same people intact were for expanded background checks;0.75;0.4321258565601833;0.3178741434398167;10;17
Turkey is an Arab country;0;1.0;-1.0;1;4
Newt Gingrichs presidential campaign has exactly the same challenges as Ronald Reagans successful 1980 bid;0.25;0.23551334361374;0.01448665638626001;6;14
The number of people in Atlanta dying from HIV and AIDS declined 59 percent between 2004 and 2012;1;0.43661343443095;0.56338656556905;10;17
Says Lee Leffingwell raised property taxes 20 percent in three years;0.5;0.5046484588009632;-0.004648458800963207;9;10
Accuses President Barack Obama of making contradictory claims about efforts to kill Osama bin Laden in 2008 and 2011;0;0.33641497613923543;-0.33641497613923543;12;18
8 years of the Clintons major losses for Democrats across the nation;0.75;0.5198185922972358;0.23018140770276418;5;11
92 percent of the jobs lost during Barack Obamas first term belonged to women;0;0.47134179635188456;-0.47134179635188456;11;13
Says President Barack Obama was responsible for the assassination of at least four American citizens in drone strikes;0.5;0.22919823932129058;0.2708017606787094;15;17
It used to be the policy of the Republican Party to get rid of the Department of Education. We finally get in charge and a chance to do something so we double the size of the Department of Education;1;0.46328466621988695;0.536715333780113;30;38
We have 395 inmates pushed into triple-bunked cells intended for two inmates and bunked in classrooms and areas supposed to be designated for inmate labor;0;0.40660775869270704;-0.40660775869270704;6;24
The ACLU didnt call for an investigation of the Newark police department they called for an immediate federal monitor;0;0.34908350312862513;-0.34908350312862513;13;18
Says his executive order requiring young girls to be vaccinated against HPV wasnt mandatory;0.25;0.3668493980697366;-0.1168493980697366;5;13
Says a highway was closed in El Paso because of bullets flying across the border;1;0.500810849509393;0.49918915049060697;7;14
If the House of Representatives fails to extend the middle-class tax cuts 400000 middle-class Rhode Island families will see their federal income taxes increase;0;0.42014059961498285;-0.42014059961498285;15;23
95 percent of the income gains in the last few years have gone to the top 1 percent;0.75;0.5296187534051713;0.22038124659482872;16;17
Eight out of the nine states with competitive Senate races Hispanics make up less than 10 percent of the electorate;1;0.47134179635188456;0.5286582036481154;11;19
We didnt go out and take information from the Hillary Clinton campaign;0.25;0.1682152610416352;0.0817847389583648;9;11
If you actually took the number of Muslims sic Americans wed be one of the largest Muslim countries in the world;0;0.46488470461191755;-0.46488470461191755;15;20
On the pace that were on with job creation in the last four months we will have created more jobs in this year than in the entire Bush Presidency;0.5;0.5088774829720237;-0.008877482972023731;21;28
