text;grand_truth;calculated;dif;found phrases;out of
Says the Annies List political group supports third-trimester abortions on demand;0;0.2747352432142167;-0.2747352432142167;4;10
When did the decline of coal start? It started when natural gas took off that started to begin in President George W. Bushs administration;0.5;0.34593495363202986;0.15406504636797014;12;23
Hillary Clinton agrees with John McCain by voting to give George Bush the benefit of the doubt on Iran;0.75;0.44509105890742884;0.30490894109257116;14;18
Health care reform legislation is likely to mandate free sex change surgeries;0;0.32596549615936377;-0.32596549615936377;6;11
The economic turnaround started at the end of my term;0.5;1.0;-0.5;6;9
The Chicago Bears have had more starting quarterbacks in the last 10 years than the total number of tenured UW faculty fired during the last two decades;1;0.4636299320840379;0.5363700679159621;16;26
Jim Dunnam has not lived in the district he represents for years now;0.25;0.32596549615936377;-0.07596549615936377;6;12
Im the only person on this stage who has worked actively just last year passing along with Russ Feingold some of the toughest ethics reform since Watergate;0.5;0.41990834657265896;0.08009165342734104;17;26
However it took $19.5 million in Oregon Lottery funds for the Port of Newport to eventually land the new NOAA Marine Operations Center-Pacific;0.5;0.4408308244300785;0.05916917556992152;7;22
Says GOP primary opponents Glenn Grothman and Joe Leibham cast a compromise vote that cost $788 million in higher electricity costs;0.75;0.3585871621304779;0.3914128378695221;7;20
For the first time in history the share of the national popular vote margin is smaller than the Latino vote margin;0.75;0.49045322282549975;0.25954677717450025;16;20
Since 2000 nearly 12 million Americans have slipped out of the middle class and into poverty;0.5;0.4067815332123885;0.09321846678761148;10;15
When Mitt Romney was governor of Massachusetts we didnt just slow the rate of growth of our government we actually cut it;0;0.3869740778683729;-0.3869740778683729;16;21
The economy bled $24 billion due to the government shutdown;0.75;0.4866828820923583;0.2633171179076417;6;9
Most of the Affordable Care Act has already in some sense been waived or otherwise suspended;0.25;0.4026601695954446;-0.1526601695954446;10;15
In this last election in November 63 percent of the American people chose not to vote 80 percent of young people and 75 percent of low-income workers chose not to vote;0.5;0.48726191912413164;0.012738080875868363;23;30
McCain opposed a requirement that the government buy American-made motorcycles. And he said all buy-American provisions were quote disgraceful;1;0.3294361769923623;0.6705638230076377;9;18
U.S. Rep. Ron Kind D-Wis. and his fellow Democrats went on a spending spree and now their credit card is maxed ou;0.25;0.10499015573872461;0.1450098442612754;16;21
Water rates in Manila Philippines were raised up to 845 percent when a subsidiary of the World Bank became a partial owner;0.5;0.5774544216093989;-0.07745442160939886;8;21
Almost 100000 people left Puerto Rico last year;0.75;1.0;-0.25;3;7
Women and men both are making less when you adjust for inflation than when John Kitzhaber was first elected governor;0;0.4031667278048332;-0.4031667278048332;10;19
The United States has the highest corporate tax rate in the free world;0.75;0.48190006882439496;0.26809993117560504;12;12
We just had the best year for the auto industry in America in history;0.75;0.5379449353895124;0.21205506461048762;12;13
Says Scott Walker favors cutting up to 350000 families and children off health care;0.5;0.45557001463231095;0.04442998536768905;7;13
Says Mitt Romney wants to get rid of Planned Parenthood;0.25;0.46360181948185053;-0.21360181948185053;9;9
I dont know who Jonathan Gruber is;0;0.17636537672864971;-0.17636537672864971;3;6
Hate crimes against American Muslims and mosques have tripled after Paris and San Bernardino;0.75;0.12667133278055587;0.6233286672194441;6;13
Rick Perry has never lost an election and remains the only person to have won the Texas governorship three times in landslide elections;0.5;0.42703505988474855;0.07296494011525145;16;22
ISIS supporter tweeted at 10:34 a.m. Shooting began at 10:45 a.m. in Chattanooga Tenn;0;-1;1.0;0;13
Youth unemployment in minority communities is about 40 to 45 percent;0.75;0.5088774829720237;0.24112251702797627;7;10
Says Paul Ryan is still endorsing Trump;1;0.32802929777521894;0.6719707022247811;4;6
If you look at states that are right to work they constantly do not have budget deficits and they have very good business climates;0.25;0.4458907623005052;-0.19589076230050517;15;23
What the Obama administration is going to come out with in the next several months is youre not even going to be able to burn coal very limitedly in the existing plants;0;0.3222493318000612;-0.3222493318000612;21;31
We cut business taxes so today 70 percent of our businesses dont pay a business tax;0.75;0.5190950351367343;0.23090496486326573;10;15
Says Mark Pryor votes with Obama 93 percent of the time;0.75;0.4762051691220741;0.2737948308779259;8;10
We have a federal government that thinks they have the authority to regulate our toilet seats;1;0.45774670008848883;0.5422532999115112;11;15
Austin is a city that has basically doubled in size every 25 years or so since it was founded;1;0.48022385953287894;0.5197761404671211;11;18
The nuclear test conducted in our nation this time is the Earths 2054th nuclear test. The five permanent members of the U.N. Security Council have conducted 99.99 percent of the total nuclear tests;1;0.45585319048686446;0.5441468095131355;16;32
In the case of a catastrophic event the Atlanta-area offices of the Centers for Disease Control and Prevention will self-destruct;0;0.500559264232701;-0.500559264232701;11;19
Under President George W. Bush we added $4.9 trillion to the debt. Under President Obama weve added $6.5 trillion to the debt;1;0.4592471751315922;0.5407528248684078;20;21
Says a U.S. Supreme Court justice suggested that some U.S. cases will be decided based on South African law;0;0.34687884568461724;-0.34687884568461724;10;18
Says Marco Rubio skipped 18 defense votes including one to arm the Kurds to fight ISIS;0.5;0.2879134535838499;0.2120865464161501;6;15
Rep. David Cicilline is responsible for the federal loan guarantee to Solyndra the failed solar compan;0;0.23663948024462012;-0.23663948024462012;8;15
Says Ohio budget item later signed into law by Gov. John Kasich requires women seeking an abortion to undergo a mandatory vaginal probe;0;0.40541627079946685;-0.40541627079946685;13;22
We have a director of homeland security who cannot use and will not use the term terrorist attack but instead substitutes man-made disaster;0;0.3287357868894647;-0.3287357868894647;13;22
African-American youth unemployment is 51 percent. Hispanic youth unemployment is 36 percent;0.5;0.42691290170567964;0.07308709829432036;6;11
Obamacare will provide insurance to all non-U.S. residents even if they are here illegally;0;0.35334953211189435;-0.35334953211189435;9;13
President Barack Obama took exactly none of his own deficit reduction commissions ideas. Not one;0;0.32596549615936377;-0.32596549615936377;8;14
It was under Barack Obama and Hillary Clinton that changed the rules of engagement that probably cost Capt. Humayun Khans life;0;0.27453378953784724;-0.27453378953784724;13;20
Hillary Clinton in 2005 co-sponsored legislation that would jail flag burners;1;0.3623439540244894;0.6376560459755106;6;10
Says the paperback edition of Mitt Romneys book deleted line that Massachusetts individual mandate should be the model for the countr;0.25;0.43739390878111584;-0.18739390878111584;13;20
Maggie Hassan raised tuition making it the highest in America;0.25;0.4838758157139337;-0.23387581571393368;6;9
Says Terry McAuliffe is the person who invented the scheme to rent out the Lincoln Bedroom;0;0.1720121632465864;-0.1720121632465864;8;15
We created 800000 new jobs we cut the unemployment rate almost in half and today New York State has more private sector jobs than it has ever had in its histor;1;0.5288723760100316;0.47112762398996844;23;30
We have towns in West Texas that are out of water that are having to truck in water;0.25;0.3927570409482618;-0.1427570409482618;12;17
In Georgia women earn 82 cents for every dollar earned by men;0.5;0.4962307520407073;0.0037692479592926764;9;11
A federal system that verifies employees are authorized to work in the U.S. is inaccurate anywhere from 50 percent all the way up to in excess of 80 percent of the time;0.5;0.44462738439508753;0.05537261560491247;19;31
They were going to build the wall a while ago not so long ago like in 06. And they couldnt get environmental impact statements;0.25;0.3685759920038334;-0.1185759920038334;13;23
Sen. Obamas campaign announced that hes choosing his cabinet;0;0.46885763510429357;-0.46885763510429357;4;8
In 2008 only 54 percent of Latinos in Texas were registered to vote and only 35 percent actually turned out;0.75;0.47151246184114826;0.27848753815885174;14;19
Only 2 percent of public high schools in the country offer PE classes;0;0.49101004108536284;-0.49101004108536284;9;12
Said hes the only Republican candidate whos actually turned around a government economy;0.75;0.44513543875439787;0.30486456124560213;10;12
On military recruiters at Harvard Elena Kagan took a position and the Supreme Court ruled unanimously that she was wrong;1;0.21611499682089097;0.783885003179109;10;19
There are 321092 public school teachers in Texas. And there are 313850 non-teachers in our public schools;0.75;0.4184616570639973;0.3315383429360027;10;16
Under Mayor Cicilline Providence was a sanctuary city;0;0.46284834525329266;-0.46284834525329266;5;7
Transgender individuals in the U.S. have a 1-in-12 chance of being murdered;0;1.0;-1.0;5;11
At Bain Capital we helped start an early childhood learning company called Bright Horizons that First Lady Michelle Obama rightly praised;1;0.388322349054264;0.611677650945736;6;20
Says the man who rushed the stage at him in Dayton Ohio had chatter about ISIS or with ISIS in his social media posts;0;0.438803881089572;-0.438803881089572;9;23
U.S. Rep. Phil Gingrey gave the government the power to electronically spy on Americans without a warrant;0.25;0.40685594407928405;-0.15685594407928405;13;16
Alex Sink funneled three quarters of a million dollars in no-bid contracts to Bank of America;0.25;0.45557001463231095;-0.20557001463231095;7;15
If you take the population growth here in Virginia we are net zero on job creation since Bob McDonnell became governor;1;0.4426925769366271;0.5573074230633729;14;20
Under Obama home values in Florida collapsed construction jobs were lost and the state had a high foreclosure rate;0.25;0.35612080389245815;-0.10612080389245815;10;18
The new Arizona immigration law says that any police officer can stop anyone who appears to them to be reasonably suspicious of being an undocumented person;0.75;0.23158093322533957;0.5184190667746604;18;25
The only time in our history when the debt has been higher than this was the end of World War II;0.75;0.5135859832622476;0.23641401673775242;19;20
The cost of health care is now the single-biggest factor driving down the federal budget deficit;0.75;0.49710907296756124;0.25289092703243876;11;15
During the recession the consumer in his native perversity has begun to save. The savings rate is now 6.2 percent;1;0.5808720904540621;0.4191279095459379;9;19
On whether a U.S. Supreme Court nominee should be forthcoming at confirmation hearings;0;0.3804136369374067;-0.3804136369374067;6;12
Says one out of three U.S. homeless men is a veteran;0.25;0.39836277356212235;-0.14836277356212235;6;10
Says Charlie Crist supports cuts to the Medicare Advantage program;0;0.42064711246626374;-0.42064711246626374;6;9
I think it is unacceptable for the Chinese today to be larger in wind power and in solar panels and photovoltaic manufacturing than all of Europe put together  forget the United States;0.5;0.4615348598696185;0.03846514013038149;16;31
Says Scott Brown co-sponsored legislation to let employers deny women coverage for birth control;1;0.29882584526736844;0.7011741547326316;13;13
At some point in their lives 99% of women use birth control;0.5;0.29563189208867213;0.20436810791132787;8;11
In the past 20 years Egypt has made great strides in political and democratic reform;0;0.4431771391515137;-0.4431771391515137;10;14
The amount of attention paid this week to Chris Christie makes the coverage of Benghazi pale in significance;0;0.43391920716409604;-0.43391920716409604;9;17
Says U.S. Rep. Steve Southerland voted to keep the shutdown going;1;0.17398770798165952;0.8260122920183405;9;10
In Rick Perrys Texas we import nurses from other countries;0.5;0.12986867148475056;0.37013132851524944;7;9
There is a federal criminal law that says its a crime to transport dentures across state lines;0.75;0.3797889371986669;0.3702110628013331;11;16
We built a new prison every 10 days between 1990 and 2005 to keep up with our mass incarceration explosion of nonviolent offenders;0.75;0.30609315806036996;0.44390684193963004;11;22
Sen. McCains tax plan provides virtually nothing to the middle class;0.25;0.32993935654255113;-0.07993935654255113;8;10
Austin is burdened by the fastest-growing tax increases of any major city in the nation;0;0.5778872695707519;-0.5778872695707519;11;14
Phoenix Arizona is the No. 2 kidnapping capital of the world;0;0.24864831664186915;-0.24864831664186915;9;10
I belong to the AFL-CIO;1;0.32596549615936377;0.6740345038406362;2;4
The insurance commissioner cant do squat about health care;0.75;0.21526545699848987;0.5347345430015101;5;8
Says a poll found him the only Republican candidate who could beat Barack Obama in Texas  and by eight points;0.5;0.5123818898061485;-0.012381889806148516;13;19
President Ronald Reagan sent troops into conflict only in one circumstance which was in Grenada We were in a peacekeeping setting in Lebanon;0.25;0.3645249885830698;-0.11452498858306981;10;22
Says David Jolly supports privatizing Social Security;0.25;0.32007089179994797;-0.07007089179994797;5;6
Did you know US population growth is at its lowest since the Great Depression;1;0.5252343598896009;0.4747656401103991;10;13
The average student in Florida what they actually pay out of pocket at our major universities for tuition is as much or less than what they spend on cellphones;0.75;0.4026761319849511;0.3473238680150489;18;28
Since 1968 more Americans have died from gunfire than died in all the wars of this countrys history;1;0.410049729450773;0.589950270549227;10;17
A foreclosure tax that would take effect in 2013 could mean a high tax bill for those facing foreclosure and millions of families who modified their mortgage or had a short sale through their lender;0.75;0.30112209563017434;0.44887790436982566;18;34
The Florida Department of Agricultures website FreshFromFlorida.com can be used to get a permit to carry a loaded hidden gun without ever leaving your house;0;0.44973279821830225;-0.44973279821830225;14;24
The Atlanta streetcar is expected to create 930 jobs during construction totaling more than 5600 jobs over the next 20 years;0;0.37760224611089255;-0.37760224611089255;11;20
Raising the minimum wage to $10.10 an hour would help lift over a million Americans out of poverty;0.75;0.5191864364074483;0.23081356359255167;15;17
Says Secretary of State John Kerry when he was a senator flew to Managua and met with a communist dictator there Daniel Ortega and accused the Reagan administration of engaging in terrorism;0.75;0.42280122055209646;0.32719877944790354;16;31
NATO is opening up a major terror division. Im sure Im not going to get credit for it but that was largely because of what I was saying and my criticism of NATO;0;0.3263118449588843;-0.3263118449588843;20;32
Sen. Obama has always had a 100 percent prochoice rating;1;0.39836277356212235;0.6016372264378776;6;9
Since Gina Raimondo took office investment fees on the states pension portfolio have gone up from about $12 million annually to about $50 million;0.5;0.43346529518092913;0.06653470481907087;12;23
The federal debt is growing by more than $4 billion a day;1;0.6079123183070619;0.39208768169293806;11;11
Under President Barack Obamas jobs bill states would no longer have to lay off teachers firefighters and police officers;0.5;0.2978041025336574;0.2021958974663426;13;18
Of our 98000 teachers who are K-12 over 53000 of those teachers today are over 50 years old;0;0.6173236979402887;-0.6173236979402887;8;17
Two-thirds of Wisconsinites receiving unemployment checks are not required to search for work due to current work search exemptions;0.75;0.47563535920177913;0.27436464079822087;7;18
Under President Obamas health-care reforms the premium for an average plan for a family didnt go down by $2500 per year its gone up about $2500 per year;0.5;0.3528665345790455;0.1471334654209545;21;27
The IRS also investigated liberal groups groups that had progressive in their name. The IRS was basically looking at everybody;0.5;0.15282422552793296;0.34717577447206704;6;19
Says Obama promised unemployment would never go above 8 percent;0.25;0.38586688909060907;-0.13586688909060907;7;9
The economy is creating jobs at the fastest pace since 1999;1;0.5074144375201823;0.49258556247981766;9;10
President Obama decided not to meet with Prime Minister Benjamin Netanyahu in New York;0.75;0.20890469516058519;0.5410953048394148;9;13
In a majority of states you can now marry freely but can still be fired for who you love;0.75;0.5148486150701916;0.23515138492980836;12;18
Say Oregon Reps. Peter DeFazio and Earl Blumenauer are socialists who are openly serving in the U.S. Congress;0;0.1873879530091308;-0.1873879530091308;10;17
Rudy Giuliani is probably the most underqualified man since George Bush to seek the presidency;0;0.5192823909517893;-0.5192823909517893;8;14
About half of the presidents have been governors;0;0.48748960643398753;-0.48748960643398753;5;7
After Britains vote to leave the European Union within 24 hours Americans lost $100 billion from our 401ks;0.75;0.25353000275352366;0.49646999724647634;7;17
Medicaid spending declined by 1.9 percent in 2012 the second such decline in 47 years;0.75;0.40660775869270704;0.34339224130729296;6;14
Says 88 Texas constables have died in the line of duty;1;0.5153331133471951;0.4846668866528049;6;10
Gov. Rick Scott cut the cost of prepaid college tuition by nearly $20000;0.75;0.4435412601808242;0.3064587398191758;8;12
The city of Columbus would save $41 million a year if employees had to contribute to their own guaranteed-check pensions;0.75;0.43180521711721087;0.31819478288278913;12;19
As Floridas CFO I shut down Krakows scam and refunded more than $1.2 million to Josephine and other victims of this con man;1;0.4758935442192066;0.5241064557807934;7;22
You had more women getting computer sciences degrees in the 80s by a factor of 2-plus than you do now;0.75;0.37528047616730664;0.37471952383269336;8;19
The Air Force wants taxpayers to fund a fantasy football league;0;0.28439622245294527;-0.28439622245294527;5;10
Barack Hussein Obama will force courts to accept Islamic Sharia law in domestic disputes;0;0.2587972182916355;-0.2587972182916355;7;13
About 3 percent of murders and crimes are committed with guns from people who actually legally purchase those guns;0.5;0.4286771678115052;0.07132283218849478;10;18
Some neighborhood schools are closing;0.75;1.0;-0.25;1;4
He told gay organizers in Massachusetts he would be a stronger advocate for special rights than even Ted Kennedy;0.75;0.2963170703425919;0.4536829296574081;7;18
The years that I was speaker the Florida House consistently offered leaner budgets than the governor offered;0.75;0.43041092485760146;0.31958907514239854;8;16
We are already almost halfway to our 2010 goal of creating 700000 new jobs in seven years;0.25;0.30213844839366366;-0.05213844839366366;10;16
Says the U.S. Supreme Court found that Social Security is not guaranteed;1;0.4419295050928702;0.5580704949071298;9;11
Says Michael Bennet wants to close Guantanamo Bay prisonand bring terrorists right here to Colorado;0;0.2539256171543266;-0.2539256171543266;7;14
Oregonians have an amazing no-cost way to fight abortion with free political donation;1;0.2879134535838499;0.7120865464161501;6;12
The president said hes going to bring in 250000 Syrian and Iraqi refugees into this country;0;0.280411019766158;-0.280411019766158;11;15
Research shows that a vast majority of arriving immigrants today come here because they believe that government is the source of prosperity and thats what they support;0.25;0.46231524390720535;-0.21231524390720535;17;26
Newt Gingrichs immigration plan offers a new doorway to amnesty;0.75;0.43487521616869784;0.31512478383130216;4;9
Mr. Caprio is a career politician who has never worked in the private sector;0;0.25374383852503046;-0.25374383852503046;10;13
In Rhode Island 9 percent of workers use the states temporary disability insurance program each year while in New Jersey the rate is only 3 percent;0.25;0.5732631095105338;-0.32326310951053383;17;25
In just 17 years spending for Social Security federal health care and interest on the debt will exceed ALL tax revenue;0.75;0.3741373264233401;0.3758626735766599;15;20
President Obama took more money from Wall Street in the 2008 campaign than anybody ever had;0.75;0.5736138901056276;0.17638610989437242;11;15
Donald Trump has said nuclear proliferation is OK;0.5;1.0;-0.5;3;7
Hillary Clinton has taken over $800000 from lobbyists;1;0.3708783449474674;0.6291216550525326;5;7
Barack Obama has never even worked in business;0;0.2891567220731024;-0.2891567220731024;5;7
Says the Arizona immigration law expressly bans racial profiling;0.5;0.25139252155548386;0.24860747844451614;4;8
Says Gov. Rick Perry has been begging for the federal government to send the Coast Guard to patrol two lakes on the U.S.-Mexico border;0;0.39664761366818213;-0.39664761366818213;17;23
On the VA: Over 300000 veterans have died waiting for care;0.25;0.4441542351298903;-0.19415423512989027;4;10
Were now spending 42 percent of our economy on government;0.75;0.4216786927877667;0.3283213072122333;7;9
Rob Cornilles supports privatizing Medicare;0.25;0.08195643645029993;0.16804356354970007;2;4
In 2005 Dan Branch tried to expand third-trimester abortions in Texas;0;0.233032709399564;-0.233032709399564;6;10
We Democrats have made steady progress creating jobs and improving our schools;0.5;0.353441995391351;0.14655800460864898;7;11
Michigan and Massachusetts raised their bottle deposit and could no longer afford the program because the redemptions were so high there was no profit in there;0;0.3331565394047674;-0.3331565394047674;10;25
Whether you like to admit it or not half our general revenue goes to education;1;0.264580987107908;0.735419012892092;10;14
Im the only one whos fought against developers draining the Everglades;0;0.46079971491130567;-0.46079971491130567;4;10
Says Ron Johnson calls Social Security a Ponzi scheme and wants to privatize the program;0.5;0.20890469516058519;0.2910953048394148;12;14
There are 31 other states and 10000 other cities that have the same type of policies that we just passed referring to North Carolinas House Bill 2;0.5;0.49191508411284246;0.00808491588715754;18;26
Climate change is directly related to the growth of terrorism;0.25;0.5088774829720237;-0.25887748297202373;7;9
The jobs bill includes President Obamas tax on soup kitchen;0.25;0.3901255377977888;-0.1401255377977888;6;9
Says the Obama administration spent taxpayer dollars on electric cars in Finland and windmills in China;0.25;0.35334953211189435;-0.10334953211189435;9;15
While Sarah was Mayor of Wasilla she tried to fire our highly respected City Librarian because the Librarian refused to consider removing from the library some books that Sarah wanted removed;0.5;0.3246914083605156;0.17530859163948442;11;30
If Milwaukee approves reducing its maximum forfeiture for marijuana possession to $50 the city would have 23 different bicycle violations that have a higher forfeiture;0.5;0.5978822153300285;-0.0978822153300285;5;24
We have more illegal immigrants here than we did five years ago;0;0.46284834525329266;-0.46284834525329266;10;11
Says Rick Perry wrote a letter supporting Hillarycare;0.25;0.46284834525329266;-0.21284834525329266;5;7
The U.S. Patent and Trademark Office received zero complaints about the Washington Redskins name;0;0.1904885529875432;-0.1904885529875432;6;13
The presidents health care proposals will cause most Americans to have their premiums increased not decreased and hundreds of millions of people lose their current insurance coverage;0;0.33838396820206074;-0.33838396820206074;15;26
Mexican immigrants are more law-abiding than U.S. citizens and that is a statistic;0.75;0.3535648865457167;0.3964351134542833;8;12
Says Chris Christie vetoed a jobs package of 30 bills;0.5;0.5627259309058377;-0.06272593090583767;5;9
There are already more American jobs in the solar industry than in coal mining;1;0.3375838790830551;0.6624161209169449;10;13
Says Illinois gubernatorial candidate Bill Bradys first priority after winning the primary was to sponsor a bill that would mass-euthanize sheltered dogs and cats in gas chambers;0.5;0.3684288194604418;0.13157118053955819;15;26
Barack Obama is in an economy thats only worsened since hes been president of the United States;0.5;0.410049729450773;0.089950270549227;10;16
Romney failed to take action against sanctuary cities in Massachusetts;0.75;0.378133713555347;0.371866286444653;5;9
Says New Jersey is down nearly 200000 jobs from its pre-recession peak and with Gov. Chris Christie New Jersey has trailed the rest of America when it comes to unemployment for 12 consecutive months;0.5;0.5275645838677463;-0.027564583867746295;21;33
