text;grand_truth;calculated;dif;found phrases;out of
47 - New provisions ObamaCare charges the IRS with implementing according to the Government Accountability Office;1;0.2906985869288944;0.7093014130711056;8;15
Josh Mandel used to be pro-choice now hes anti-choice. He used to be sympathetic towards gay and lesbians and now hes not;0.5;0.35390865125901905;0.14609134874098095;12;21
Brewpubs cant sell growlers of their beer to customers;1;1.0;0.0;1;8
Did U know? Block Island Wind Farm would mean 40% est. drop in BI electric rates;1;0.19995761057706163;0.8000423894229384;3;15
Obamacare-caused paperwork will annually absorb 190 million hours or moreand Mount Rushmore could be built 1547 times over with the paperwork;0.25;0.5259988347088118;-0.2759988347088118;4;20
Fifty percent of our students who enter higher education need to take remedial courses because they are not prepared for college-level work;0.25;0.31737653123121246;-0.06737653123121246;13;21
We have over 300000000 weapons firearms in this country. Thats almost as big as the population;1;0.5742959530998443;0.42570404690015573;10;15
Both Cruz and Rubio are missing the vast majority of their votes;0.25;1.0;-0.75;5;11
The five Taliban detainees being released from Guantanamo in exchange for captured Army Sgt. Bowe Bergdahl are the hardest of the hard-core. These are the highest high-risk people;0.75;0.32732031542463236;0.42267968457536764;13;27
Says Israel Prime Minister Benjamin Netanyahu didnt change his position on a two-state solution;0.25;0.49749190939949994;-0.24749190939949994;6;13
Says women who need a sonogram in the eighth to 10th week of pregnancy have to get a transvaginal sonogram;0.75;0.4179328341157331;0.3320671658842669;12;19
Theres still about $400 billion or $500 billion of the stimulus plan that has not been spent. Why dont we stop it;0;0.36365921262159406;-0.36365921262159406;13;21
Says Alex Sink supported a $5.2 billion increase in Floridas debt;0.25;0.26345958618171217;-0.013459586181712169;6;10
Of the topfive cities for staged automobile accidents three are in Florida. We rank No. 1 in the country in staged auto accidents;0.75;0.5207688444425912;0.2292311555574088;10;22
Frank Guinta voted to make middle class taxpayers pay over a $1000 more a year in taxes;0.25;0.3613223560509897;-0.11132235605098972;12;16
For years now we have spent more money than we have taken in;0.5;0.3476631188059025;0.1523368811940975;12;12
Senate Democrats who left the state for weeks to delay a vote on union bargaining power exercised a Wisconsin filibuster provided by the states constitution;0.25;0.27721791728555767;-0.02721791728555767;14;24
The Pink Pony club in DeKalb County has never been cited for any violation of an ordinance or state law;1;0.6182123988899018;0.38178760111009824;11;19
Since 2008 Gwinnett Countys population has grown 15 percent while the county government staff has increased only 1 percent;1;0.5633660129313822;0.4366339870686178;12;18
Harry Reid was against the nuclear option before he was for it. Mitch McConnell was for it before he was against it. President Obama was against it before he was for it;1;0.34954445069092455;0.6504555493090755;23;31
North Korea is telling its people that their mens national team is in the World Cup final;0;0.3097745110420087;-0.3097745110420087;10;16
Says David Jolly refused to cut spending for a national greenhouse in D.C;1;0.4725386915679788;0.5274613084320212;8;12
Says David Dewhurst went out for drinks during Senate debate on abortion bill;0.5;0.337097466544636;0.16290253345536398;5;12
The CDC issued a report commissioned by President Obama just earlier this year and it found some very inconvenient facts. Armed citizens are less likely harmed by attackers. Effectiveness of gun control laws is mixed. Gun buybacks dont work;0.5;0.4089312143829542;0.09106878561704579;18;38
The Walton family of Walmart This one family owns more wealth than the bottom 40 percent of the American people;1;0.48877987868086037;0.5112201213191396;15;19
Cuccinelli wants to make all abortion illegal even in cases of rape and incest even to protect a womans health;0.25;0.3875437680141708;-0.1375437680141708;16;19
Says Rand Paul thinks drug-dealing theft burglary and prostitution should be decriminalized;0;0.34381587290167226;-0.34381587290167226;3;11
By the time you drink your coffee an elephant is killed for its ivory tusks;0.5;0.2983733683495339;0.20162663165046613;6;14
The overwhelming amount of the money that were raisingis not going to Hillary Clinton to run for president. Its going to the congressmen and senators to try to take back Congress;0.5;0.35124366163438736;0.14875633836561264;19;30
When Sarah Palin was in government Barack Obama was a community organizer;0;0.17339658227747756;-0.17339658227747756;7;11
Says his 9-9-9 tax reform plan is not regressive;0;0.27512198477320904;-0.27512198477320904;6;8
About half the people who would qualify for Medicaid expansion in Florida can buy a health care plan for $30 a month on the federal health care exchange;0.5;0.35003575182349256;0.14996424817650744;22;27
Until the new Iran deal China and Russia have never voted with us at the U.N. on any sanctions on Iran in the past;0;0.3234120083955916;-0.3234120083955916;16;23
Insurers delayed an Illinois mans treatment and he died because of it;0;0.35567107162791667;-0.35567107162791667;4;11
Says Hillary Clinton supported North American Free Trade Agreement and she supported Chinas entrance into the World Trade Organization. She supported the job-killing trade deal with South Korea. She supported the Trans-Pacific Partnership;0.75;0.2895431770357202;0.4604568229642798;18;32
Says there are Ohio Turnpike workers getting paid $66000 a year to collect tolls that machines might collect;0.75;0.37068929158502306;0.37931070841497694;6;17
Fox changed around their poll eligibility criteria on the day they announced who is in and out of their debate;0.5;0.3851676258533183;0.11483237414668168;7;19
Since being elected Tom Barrett has dumped 8.2 billion gallons of raw sewage into Lake Michigan;0.25;0.21972625618832475;0.030273743811675247;6;15
An audit shows there are 6.5 million people who have active Social Security numbers who are 112 years of age or olde;1;0.2985585578135317;0.7014414421864683;11;21
Both China and Japan have surpassed us with Japanese cars now getting an average of 45 miles to the gallon;0.5;0.4666948551125314;0.03330514488746861;8;19
This administration is slashing the Navy to pay for more Obamacare;0;0.3784397986390615;-0.3784397986390615;7;10
Since President Obama took office our federal spending has increased by nearly 30 percent and our national debt has increased by almost 50 percent;0.5;0.46871277697685687;0.03128722302314313;22;23
McCain will give more tax breaks to big oil;0.25;0.3550132888562927;-0.10501328885629269;6;8
Since President Obama took full control of Washington every day 13000 more people have been put on food stamps;0.5;0.3675280217197301;0.1324719782802699;16;18
The election bill allows persons to correct an absentee ballot if they did not sign it and requires an extra two hours a day for early voting. Everything else in this bill is discretionary;0.5;0.3417704060752217;0.1582295939247783;21;33
Says President Barack Obama will not utter the words radical Islamic terrorism and as matter of policy nobody in the administration will say the words radical Islamic terrorism;1;0.2699326838116701;0.7300673161883299;17;27
More than 64 percent of minimum-wage earners are women;1;0.37068929158502306;0.6293107084149769;3;8
President Barack Obama deserves to be called the most successful food stamp president in American history because 47 million Americans are on food stamps;0.5;0.3746142733467325;0.12538572665326753;17;23
Says Maggie Hassan pays zero property taxes on her $500000 home;0.25;0.23650274252578873;0.013497257474211266;5;10
Under the Obama plan all the health care in this country is eventually going to be run by the government;0;0.2869943720471555;-0.2869943720471555;14;19
Says Obama called Medicaid broken four years ago;0.75;0.5259988347088118;0.2240011652911882;4;7
In the U.S. agreement with the Cuban government no commitment was made to allowing the establishment of political parties or to even begin the semblance of a transition to a democracy;0.75;0.44547260736810435;0.30452739263189565;15;30
Ryan Sittons company accepted over $650000 in Obama stimulus dollars;0;1.0;-1.0;1;9
For four days in Denver the Democrats were afraid to use the words Islamic terrorism;0.25;0.26892164975934085;-0.018921649759340853;9;14
A former Clinton administration official and other economists agree that if you keep extending these temporary unemployment benefits youre just going to extend joblessness even more;0.5;0.28248363732324655;0.21751636267675345;11;25
In the past decade K-12 funding has grown six times faster than the rate of enrollment;0.5;0.45035543243297915;0.04964456756702085;12;15
Cities like Seattle have decided to ban food carts;0.25;0.2983733683495339;-0.048373368349533874;2;8
Creating 25 jobs in Umatilla County has the same impact as 500 jobs in the metro region;0.75;0.38381410813794525;0.36618589186205475;8;16
Will HB2threaten federal funding for public schools under Title IX? No according to a federal court which has looked at a similar issue;0.5;0.5135346110475036;-0.013534611047503642;11;22
Some of the things that Megyn Kelly said I didnt say;0;0.22633042820317273;-0.22633042820317273;9;10
Says an amendment specifying when military members may use deadly force does nothing to change existing rules of engagement for American service members;1;0.40435844064014403;0.595641559359856;11;22
Sometimes I was the only no vote on the entire board;1;0.5126118505723889;0.4873881494276111;8;10
Monica Wehby and Jason Conger are causing devastating consequences for nearly 23000 Oregonians looking for work;0;1.0;-1.0;3;15
After the U.S.-led military alliance ejected Saddam Husseins forces from Kuwait in 1991 the Kuwaitis never paid us;0;0.38561700361271156;-0.38561700361271156;3;17
The total state payroll has gone down. The total amount of the number of workers in the state has gone down. I like the fact that the bulk of that is just by retirements;0.5;0.43898668573837984;0.061013314261620155;25;33
Says the estate tax is a threat to family farms;0.25;0.22663316643471176;0.023366833565288236;8;9
We can fix our roads without raising taxes;0;0.5259988347088118;-0.5259988347088118;4;7
Says Michelle Obama waved red communist flags on her trip to China;0;0.27512198477320904;-0.27512198477320904;6;11
Only 14 percent of Catholics agree with the Vaticans position that abortion should be illegal;0.75;0.4766927473309073;0.2733072526690927;10;14
Says Donald Trump is against minimum wage;0.25;0.5398592604843745;-0.2898592604843745;5;6
Less than 1 percent of 1 percent of the American population has given an amount over $200 to a federal political campaign;0.25;0.5135806107574314;-0.26358061075743144;15;21
Obama couldnt have afforded his home without Rezkos help;0;0.44726729788048003;-0.44726729788048003;2;8
Obama Skips Out On Condemning Left-Wing Attacks On Gen. Petraeus Despite Casting Other Important Votes Earlier And Later In The Day;1;0.41232625474145423;0.5876737452585458;4;20
Americas least-trusted news sources are also its most popular;0.5;0.6488442917452586;-0.1488442917452586;3;8
Among the nations 51 largest metropolitan areas Milwaukee is the only one where the poverty rate is more than four times greater in the city than it is in the suburbs;0.5;0.4415357111128211;0.05846428888717892;21;30
Only three in 10 Texas doctors are currently accepting new Medicaid patients;0.25;0.5400009404432287;-0.29000094044322866;7;11
Obamas first call as president to any head of state was to Mahmoud Abbas leader of Fatah party in the Palestinian territory;0.5;0.2462209328449566;0.2537790671550434;12;21
The Clintons now charge the Secret Service $10000 monthly rent for the use of a Secret Service residence and that rent is just about equal to their mortgage payment;0;0.3555057992644861;-0.3555057992644861;16;28
Says an appointed board created under Obamacare will have the ability to come between you and your doctor in determining the best treatment options for you;0;0.18024453428064402;-0.18024453428064402;17;25
Says that over the past 20 years Texas public school spending rose 142 percent and per-pupil spending more than tripled when adjusted for inflation;0.25;0.4986113193967018;-0.24861131939670178;16;23
David Cicilline is the 5th most liberal person in the House of Representatives;0;0.37024726100561567;-0.37024726100561567;9;12
Says U.S. Senate Democrats have gone without any budget at all for more than 1000 days;0.75;0.3833367147801017;0.3666632852198983;11;15
Saysthe State Department has had half a year to respond to a Benghazi document request yet I have not gotten a single solitary scrap of paper;0.25;0.40808769103169484;-0.15808769103169484;16;25
Republican leaders said no to tax cuts for 95% of working Americans;0.25;0.3452697086573654;-0.09526970865736539;8;11
We confer more PhDs each year than any other university in America except Berkeley;0.25;0.4567335275661141;-0.20673352756611407;7;13
The Obama administration raised discretionary spending by 24 percent from President George W. Bushs last full-year budget and will run up more debt by October than Bush did in eight years;0.5;0.33379006526585087;0.16620993473414913;22;30
200000 students attempt suicide every year on college campuses;0.5;0.5259988347088118;-0.025998834708811813;4;8
For the first time in eight years our budget also increases funding for persons with disabilities by $36 million to help more disabled people receive community-based services;0.75;0.4740299987374563;0.2759700012625437;14;26
Taking all the money of the top 1 percent wouldnt keep Medicare going for three years;0.25;0.46602665557474166;-0.21602665557474166;9;15
The majority of the American people voted for a Democratic House;0.75;0.4227556441430512;0.3272443558569488;10;10
We have the highest corporate tax rate in the world. Its 35 percent;1;0.5300970329972836;0.4699029670027164;10;12
Newt balanced the federal budget;0.5;0.5212195743562905;-0.021219574356290516;3;4
Says Donald Trump was forced to file for bankruptcy not once not twice four times;0.75;0.49035785345810257;0.25964214654189743;11;14
Says that in his first 17 months as president the United States doubled its world-leading $500 million a year commitment to fighting global AIDS;1;0.38094795565574713;0.6190520443442529;15;23
The cost of fire in Rhode Island is anywhere from 33 percent to 100 percent more expensive than anywhere else we could find;0.5;0.4100589426124519;0.0899410573875481;18;22
Iranian mullahs took American hostages and they held the American hostages for 444 days. The one hour in which they released them was the one hour in which Ronald Reagan was taking the Oath of Offic;0.25;0.35778539513082086;-0.10778539513082086;14;35
Mayor White has major stake in Barnett Shale production company;0.25;1.0;-0.75;1;9
Rep. Jim Renaccis plan to end Medicare also puts nursing home care for 3000 seniors in the district in immediate jeopardy;0.25;0.2742700508399648;-0.024270050839964807;12;20
When we passed the stand your ground law we said it portends horrific events when peoples lives were put into these situations;1;0.31860296929308296;0.681397030706917;12;21
The federal government has made investments in science and technology inventing the products that led to the creation of Google;0.75;0.36171037679004503;0.38828962320995497;12;19
Weve seen more anti-womens choice bills introduced in the first half of this session than weve seen in the last three General Assemblies;1;0.4003837648578846;0.5996162351421154;14;22
Says his administration put more border patrol agents on the U.S.-Mexico border than at any time in history and the flow of undocumented workers across the border is actually lower than its been in 40 years;0.5;0.4972071050378498;0.002792894962150183;30;35
On Syria alot of the allies signed on. At the last minute Obama backed off;0.25;0.39990243714214935;-0.14990243714214935;5;14
Already this calendar year since January 1 we have had more than 20000 people come across the border apprehended unauthorized;1;0.3996079916855102;0.6003920083144898;12;19
Jim Renacci tried to avoid paying taxes on nearly $14 million that he made;1;0.35619279993766606;0.6438072000623339;10;13
Barack Obama accepted $200000 from executives and employees of oil companies;1;0.39400279217359613;0.6059972078264039;5;10
In an interview with the Chicago Tribunes Editorial Board Comptroller Leslie Munger says that in order to balance a budget the state would have to cut social services completely;0;0.3304290506862315;-0.3304290506862315;18;28
Iowa for good reason for constitutional reasons for reasons related to the Lord should be the first caucus and primary;0;0.452334496341239;-0.452334496341239;8;19
The unemployment rate among blacks in Texas is 9.5%  far more than double white unemployment  and wages have fallen for black workers in Texas since 2000;1;0.3903780574338892;0.6096219425661108;18;25
Obamacare could cause 20 million people to lose their current coverage;0.25;0.2916623215213987;-0.041662321521398704;9;10
Children are crossing the border because President Barack Obama said if you come youre going to be able to stay because were not going to enforce the law;0.25;0.2584813318364442;-0.008481331836444173;21;27
Says U.S. Rep. Tammy Baldwin is backing President Barack Obamas plan to pass a $1.5 trillion tax increase;0;0.20589113709549922;-0.20589113709549922;12;17
Over the past decade the big five oil companies - BP Chevron Conoco Phillips Exxon Mobil and Shell  made a total profit of nearly $1 trillion;0.75;0.40924272900386294;0.34075727099613706;13;25
When Mitt Romney was governor the fact is that the average income for a family in Massachusetts went up by $5500;0.5;0.4040356495818678;0.09596435041813223;16;20
Twenty million Americans are out of work;0.5;0.4970498906847355;0.0029501093152645153;6;6
Net immigration from Mexico last year was zero. Fact-check me;0.75;0.5043145804687841;0.24568541953121592;4;9
The Republican plan for tax cuts is to give each millionaire  the top 1 percent of income in this country  $83347 a year in tax cuts;0.75;0.4421529104368159;0.3078470895631841;19;25
A proposed revenue smart cap gives Floridians a voice requiring a 60 percent vote by citizens in order to impose a new tax fee license fine charge or assessment;0;0.2969009319010957;-0.2969009319010957;12;28
Eighty-five percent of every dollar donated to the Clinton Foundation ended up either with the Clintons or with their staff to pay for travel salaries and benefits. Fifteen cents of every dollar actually went to some charitable beneficiary;0.25;0.3663463850162094;-0.11634638501620942;23;37
Fourteen million Americans mortgages are greater than the value of their homes;1;1.0;0.0;8;11
The U.S. Postal Service doesnt run on your tax dollars. Its funded solely by stamps and postage;0.5;1.0;-0.5;7;16
Cheney is disagreeing with President Bushs policy. President Bush stated repeatedly to international audiences and to the country that he wanted to close Guantanamo;0.5;0.36353958424567445;0.13646041575432555;13;23
Barack Obamas nominee for regulatory czar has advocated a Fairness Doctrine for the Internet that would require links to opposing opinions;0.5;0.43000122290082476;0.06999877709917524;10;20
Weve created more than 850000 jobs more than all the other states combined;1;0.4157208538016499;0.5842791461983501;9;12
There is no reason to allocate 60 percent of bridge space to satisfy two percent of all travelers;0.5;0.5116691303855632;-0.011669130385563165;9;17
A United Nations working group has adopted a proposed agenda to enable member nations to disarm civilians within their borders;0;0.311909541792199;-0.311909541792199;6;19
Says she balanced a $10 billion budget shortfall without raising taxes;0.25;0.29373816748426496;-0.043738167484264956;7;10
If 20 million illegals vote you can kiss the Second Amendment goodbye;0;0.26504488455053055;-0.26504488455053055;4;11
Planned Parenthood has now been found to also illegally sell baby parts;0;0.2742700508399648;-0.2742700508399648;6;11
Anyone can die of a toothache;1;0.41625434093512226;0.5837456590648777;3;5
Says Jim Frishe wanted to tax us for doing our taxes through an accountant;1;0.42425403754379676;0.5757459624562032;5;13
When Republicans last controlled the presidency and Congress the number of people on food stamps and the number of people in low-income housing went through the roof;0.75;0.41771540290080433;0.33228459709919567;18;26
This year the Austin City Council granted a small homestead property tax exemption of $5000 applied equally to everyone. And we also granted an exemption for the elderly and the disabled members of the community;0.25;0.4321157940058652;-0.1821157940058652;17;34
Perry pushed for a law that lets insurance companies raise homeowners rates without having to justify the increase;0;0.35081869798598664;-0.35081869798598664;9;17
Jason Carter backed three of Nathan Deals budgets but accuses the governor of underfunding education;1;0.33688522648139785;0.6631147735186022;5;14
Says President Obama was wrong about Muslims historical contributions to mankind such as algebra actually that was the ancient Babylonians the compass that was the Chinese pens the Chinese again and medical discoveries;0.25;0.436556836775815;-0.18655683677581503;14;32
As a congressman Mark Neumann voted four times to increase our debt;0.5;0.5367987393492331;-0.036798739349233056;7;11
On oil drilling off Floridas coas;1;0.26504488455053055;0.7349551154494695;4;5
If parents dont have health insurance that Senator Obama wants them to have for their children they will be fined;0.5;0.25795620713452805;0.24204379286547195;15;19
The projected revenue from the Mayweather/Pacquiao fight is larger than the annual GDP of 29 different countries;0;0.5291641806034608;-0.5291641806034608;8;16
Says sixty-two percent of small businesses over the last five years went under because they couldnt pay their health care bills;0;0.36688308240953604;-0.36688308240953604;15;20
Since welfare reform was signed into law the number of families living in extreme poverty has more than doubled;0.75;0.4653568667058573;0.2846431332941427;15;18
Theres a tax credit of $2400 to bond former inmates that an employer would get for hiring a convicted felon. Theres a federal bonding program  you can get $5000 to $25000 in federal money to hire a convicted felon. And theres federal grants for felons to set up their own small businesses;0.25;0.41380794821805444;-0.16380794821805444;26;51
Jesus was an undocumented immigrant;0;0.45511017963992206;-0.45511017963992206;2;4
On gay marriag;0;0.24638104360244772;-0.24638104360244772;2;2
Ann Kuster supports the government takeover of healthcare which robs Medicare of over $700 billion;0;0.23545903749781583;-0.23545903749781583;9;14
The Opportunity Scholarship Act would be funded directly from public school budgets. So it would absolutely take money out of the public school system to transfer to private and religious schools;0.75;0.3828674849525725;0.3671325150474275;18;30
While Rob Portman relies on his super PAC and a handful of billionaires to do his dirty work we dont have a super PAC and quite frankly we dont want one that spends millions to spew out lies and distortions;0.5;0.26844401479357916;0.23155598520642084;24;39
This Ebola is not as bad as SARSwas in 2003;0.25;0.41625434093512226;-0.16625434093512226;6;9
A couple of debates ago Donald Trump said if you dont support socialized health care youre heartless;0;0.36434407571135075;-0.36434407571135075;9;16
Its four or five states where the number of insurance options have narrowed under the Affordable Care Act;0;0.29103358575407934;-0.29103358575407934;12;17
Ethanol reduced gas prices by 89 cents per gallon in 2010 and if ethanol disappeared gas prices could rise by as much as 92 percent;0.25;0.22773819313869215;0.022261806861307853;13;24
The sequester wont consider whether were cutting some bloated program that has outlived its usefulness or a vital service that Americans depend on every single day. It doesnt make those distinctions;0.75;0.37859856337907793;0.37140143662092207;11;30
Final election 2016 numbers: Trump won the popular vote;0;0.37068929158502306;-0.37068929158502306;3;8
Says opponents of proposed Austin school district bonds say the districts debt load doubles with these new bonds;0.5;0.36409455463926566;0.13590544536073434;7;17
Says campaign contributions to her rival for a state House seat was money intended for schoolchildren;0;0.28436971216936613;-0.28436971216936613;8;15
Says a 1915 referendum on womens right to vote went down in New Jersey. And it took the Legislature to pass it;1;0.3534050652884857;0.6465949347115143;14;21
Says U.S. House candidate Carlos Curbelo supported ending the Medicare guarantee;0;0.23510754426276814;-0.23510754426276814;8;10
The Obama administration was successful in rushing a massive spending bill through Congress in just two days after which it sat on the presidents desk for three days while he was away on vacation;0;0.35133872151545853;-0.35133872151545853;22;33
In 1992 Barack Obama directed Project Vote - an arm of ACORN that also encouraged voter registration;0;0.26345958618171217;-0.26345958618171217;3;16
In this country we have a 25 percent dropout rate;0.5;0.5153175006254518;-0.015317500625451785;7;9
In the last seven years of my tenure Texas created 1.5 million new jobs. As a matter of fact without Texas America would have lost 400000 jobs;0.75;0.44847182022820575;0.30152817977179425;19;26
