text;grand_truth;calculated;dif;found phrases;out of
Georgias U.S. senators voted for legislation that would gut clean air protections and increase oil dependence;0.5;0.2742700508399648;0.2257299491600352;6;15
Romneycare was model for Obamacare;1;0.38561700361271156;0.6143829963872884;3;4
The Providence Economic Development Partnership . . .which you Cicilline chaired loaned $103000 in taxpayer funds to one of your campaign workers. The worker never paid back the loan;0.75;0.23281279380814768;0.5171872061918523;11;28
No doctors who went to an American medical school will be accepting Obamacare;0;0.30073992823413165;-0.30073992823413165;7;12
The $290 million structural surplus in the 2011-13 Wisconsin budget is not real because it is based on the assumption that Congress will reinstate the estate tax;0;0.3481693449707953;-0.3481693449707953;16;26
Dan Patrick changed his name from Danny Goeb to hide from his debts;0;0.4200276504354795;-0.4200276504354795;7;12
Were paying out-of-state residential facilities hundreds of thousands of dollars if not more to house children in state custod;0.75;0.4184451295000273;0.3315548704999727;11;18
The per-pupil cost in the Blackstone Valley Prep Mayoral Academy far outweighs the per-pupil cost in Cumberland public schools;0.25;0.6294117664431459;-0.3794117664431459;11;18
Before April 22 we have restored the rights of more than 18000 individuals which is more than the past seven governors combined in their four-year terms;1;0.446848862580838;0.553151137419162;16;25
The federal Hate Crimes Prevention Act bill would create special protection for pedophiles;0;0.42453516847953543;-0.42453516847953543;4;12
Says Wisconsin Supreme Court candidate JoAnne Kloppenburg put an 80-year-old farmer in jail for refusing to plant native vegetation on his farm;0;0.3097745110420087;-0.3097745110420087;10;21
In 1935 more than 50% of the elderly population lived in poverty. Today that poverty rate stands officially at 9.4%;1;0.4006601621875371;0.5993398378124629;8;19
Superdelegates have never been a determining factor in who our nominee is since theyve been in place since 1984;0.75;0.39963860324872946;0.35036139675127054;7;18
Says the Republican state convention is actually larger than the Republican National Convention;0.75;0.4072550974066286;0.3427449025933714;9;12
In his book Ken Cuccinelli questions whether Medicare and Social Security should exist;0.25;0.3045747630141068;-0.0545747630141068;6;12
There are 500 million Internet users and 80 million bloggers who are driving discussions in China. So youve got a lot of people voicing frustration and discontent;0.75;0.4635064412905513;0.2864935587094487;10;26
My son had to resign his job because of federal regulations that Washington has put on us;0.75;0.3717559718105038;0.3782440281894962;12;16
The Senate health care bill would leave 24 million people without insurance coverage;1;0.2962037107132043;0.7037962892867957;10;12
More Americans receive food aid than work in the private sector;0;0.3701728926257215;-0.3701728926257215;6;10
Illegal tobacco sales price driven too high has been connected to at least several cases of funding terrorism against us in multi-year investigations over the last decade and a half;0.75;0.44086660780640696;0.30913339219359304;13;29
Some of our states educational administrators joined the feds in seeking to mandate Arabic classes for Texas children;0.25;0.3647804594809948;-0.1147804594809948;7;17
Says Land Commissioner Jerry Patterson threatened to shoot him;0;0.15796814448622465;-0.15796814448622465;3;8
Between 1980 and 2010 water usage in Georgia dropped even as the states population grew;1;0.5632576296327867;0.4367423703672133;9;14
The General Assembly has no explicit constitutional authority to impose income sales estate and the myriad of other taxes upon us;1;0.43356353592117536;0.5664364640788246;8;20
Inside the stimulus package is anti-Christian legislation that will stop churches from using public schools for meeting on Sundays as well as Boy Scouts and student Bible study groups;0;0.23492882981746321;-0.23492882981746321;12;28
A Wisconsin bill to limit use of food stamps for junk food would also prevent  or limit  the extent to which food stamps could be used for organic foods;0.75;0.39921179982895516;0.35078820017104484;14;28
Were losing thousands of veterans waiting on line because they cant get speedy health care from the Veterans Administration;0.5;0.2944849570725757;0.20551504292742429;11;18
The newly proposed House Republican budget abolishes Medicare within 10 years;0;0.3946292421739771;-0.3946292421739771;4;10
Says George LeMieux falsely attacked Marco Rubio;0.75;0.5212195743562905;0.22878042564370948;3;6
There are fewer people crossing the southwest border than in the last 30 years;0.75;0.3527409221740905;0.3972590778259095;12;13
Health insurance costs for Floridians are up 30 percent or more;0.25;0.3351024008581309;-0.08510240085813092;8;10
Says Lamar Smith sponsored the bill that funded Obamacare;0;0.26504488455053055;-0.26504488455053055;4;8
On responding to chemical weapon use in Syri;0.5;0.44726729788048003;0.05273270211951997;2;7
The LGBT community is more often the victims of hate crimes than any other recognized group;1;0.4480277521555719;0.5519722478444281;7;15
Obama has maintained a friendship with a now convicted felon;0.75;0.2983733683495339;0.4516266316504661;2;9
Says Mitt Romneys carried interest income was a tax trick;0.25;0.2983733683495339;-0.048373368349533874;4;9
Since ObamaCare and the stimulus passed the unemployment rate in the U.S. has increased;0;0.4434085477029296;-0.4434085477029296;13;13
In 2011 there were more than 28000 new Tennessee jobs created and over $4 billion in capital investment. Our Jobs4TN plan is working;0.5;0.40305205023384594;0.09694794976615406;13;22
Each day our nation pays communist China $73.9 million in interest on our debt;1;0.5630615192738984;0.43693848072610164;7;13
Sen. Jim Webb persists on negating Sen. Mark Warners vote;0;0.47127181000625473;-0.47127181000625473;5;9
Rhode Island has a very generous unemployment compensation rate compared to most other states;1;0.5700534887704597;0.4299465112295403;7;13
Says she called for addressing risks of derivatives cracking down on subprime mortgages and improving financial oversight early on in the financial crisis;1;0.4710497927420062;0.5289502072579938;12;22
There is a constitutional issue that affects the paychecks of members of Congress during a shutdown;1;0.3699702139251334;0.6300297860748666;10;15
No one in the private sector gets unlimited accruals of vacation and sick leave;0.5;0.33688522648139785;0.16311477351860215;5;13
Says Obama has flip-flopped on public campaign financing;1;0.43231096611994;0.56768903388006;5;7
Back door gun control is in full effect in the United States due to Obamas Environmental Protection Agency;0;0.3745249304624456;-0.3745249304624456;12;17
The Obama administration originally wanted 10000 troops to remain in Iraq  not combat troops but military advisers special operations forces to watch the counterterrorism effort;0.75;0.32026444262364995;0.42973555737635005;9;24
ICE just endorsed me;0.25;-1;1.25;0;3
Tax increases under Michigan Gov. Jennifer Granholm led to state unemployment going from 6.8 percent to 15.3 percent;0.25;0.4668016372087618;-0.21680163720876178;7;17
Ronald Reagans signature on the 1986 amnesty act gave Barack Obama about 15 million additional Hispanic votes in 2012;0;0.37649621110975995;-0.37649621110975995;8;18
Nevada lawmakers permanently cut taxes for over 95 percent of Nevadas businesses;0;0.4402461755303554;-0.4402461755303554;6;11
Says Texas U.S. Rep. Pete Sessions said the GOPs goal is to go back to the same exact policies that were in place before this president took office policies that crashed the economy;0.25;0.34254892921314417;-0.09254892921314417;22;32
Says Donald Trump said the government is going to pay for everybody to have health care;0;0.39963860324872946;-0.39963860324872946;14;15
Says 11 states have more people on welfare than employed;0;0.32038527570825315;-0.32038527570825315;7;9
Says former Federal Reserve Chairman Alan Greenspan said that if the workers are more insecure thats very healthy for the society because theyll serve the masters gladly and passively;0;0.2963216603797705;-0.2963216603797705;14;28
On the economic stimulus;0.5;1.0;-0.5;3;3
Neighborhoods have become more violentunder President Barack Obamas watch;0.25;0.35070459609491866;-0.10070459609491866;4;8
Obama admin gutted ProjChildSafe budget to provide trigger locks and safety kits;0;0.5603187440949009;-0.5603187440949009;2;11
Barack Obamas health care plan would leave 15-million Americans out;0.5;0.2533052625586848;0.2466947374413152;7;9
Our high school graduation rate is the highest on record;0.5;0.44456897879077284;0.05543102120922716;8;9
Say Ohio Reps. Marcia Fudge Marcy Kaptur and Dennis Kucinich are socialists who are openly serving in the U.S. Congress;0;0.1620527064906132;-0.1620527064906132;11;19
Were not engaged in nation-building in Afghanistan;0.5;0.26504488455053055;0.23495511544946945;4;6
Says the Defense Department shrink-wrapped $10.8 billion in American money loaded it on 175 pallets and put it on a transport plane to Iraq where they passed out $100 bills and no one has any receipts;0.25;0.42246079792610247;-0.17246079792610247;21;35
Says he stood up to his own party by voting against the budget to stop runaway government spending;0.25;0.3770164590387741;-0.12701645903877412;14;17
Democrats very much are in the pocket of the NRA;0.25;0.4480277521555719;-0.1980277521555719;7;9
Floridas proposed amendment for medical marijuana would allow people who alleged minor ailments such as muscle spasms neck pain back pain and even menstrual cramps to qualify for government-sanctioned pot-smoking;0.75;0.43175741536935386;0.31824258463064614;11;29
Some doctors say Ebola can be transmitted through the air by a sneeze or some cough;0;0.26345958618171217;-0.26345958618171217;6;15
We the bishops of the United States  can you believe it  in 1919 came out for more affordable more comprehensive more universal health care;1;0.35203526524568574;0.6479647347543143;12;23
On support for Ronald Reagans policie;0;0.1179701686558029;-0.1179701686558029;4;5
Says Supreme Court nominee Merrick Garlandvoted so the folks know in Washington D.C. to keep guns away from private citizens;0;0.36513267112370706;-0.36513267112370706;12;19
Forty years ago hardly anybody in the country had health insurance;0;0.4651502165860131;-0.4651502165860131;5;10
Supreme Court 15 times over the last 120 years has said marriage is a fundamental right and never said it had to be between a man and a woman;1;0.34800831595391335;0.6519916840460867;22;28
Says Alex Sink supported more taxes on water and TV;0.75;0.3374736034055409;0.4125263965944591;8;9
Im self-funding my own campaign;0.5;-1;1.5;0;4
For every Kentuckian that has enrolled in Obamacare 40 have been dropped from their coverage;0;0.46522460339633964;-0.46522460339633964;8;14
More Americans have lost their jobs under Barack Obama than any president in modern history;0.25;0.31737653123121246;-0.06737653123121246;13;14
Says the money is in the budget to give a tax break to everyone including people making more than $1 million;0;0.4991776263132318;-0.4991776263132318;17;20
Says 2012 was the first year in American history that more minorities are being born than people in the majority;0.5;0.40924272900386294;0.09075727099613706;13;19
On the status of illegal immigrant;0.5;0.35567107162791667;0.14432892837208333;4;5
Its going to be harder to vote in Virginia than it is now to buy a gu;0.5;0.36500716002741085;0.13499283997258915;14;16
Says Dan Patrick has called immigration into Texas an invasion and said immigrants coming into Texas bring third-world diseases;1;0.19995761057706163;0.8000423894229384;6;18
Harry Reid voted to use taxpayer dollars to pay for Viagra for convicted child molesters and sex offenders;0.25;0.3126221793994812;-0.06262217939948123;12;17
The average time someone used to hold a share of stock back in the 60s was eight years. Now the average time is four months;0.75;0.46964796194553027;0.28035203805446973;12;24
Since 1904 the Ohio victor has won the presidency 25 out of 27 time;1;0.5398592604843745;0.4601407395156255;5;13
Under Obamacare members of Congress are required to purchase their health insurance from the new exchanges;1;0.39131561387301317;0.6086843861269868;11;15
25% of human trafficking victims are located in Texas;0;0.25737503561784647;-0.25737503561784647;6;8
While fat-cat bureaucrats at the Department of Education are getting paid an average salary of $102000 a year teachers in Georgia are getting paid half of that;0.75;0.42939041542098944;0.32060958457901056;16;26
Says Chris Christie was behind in the polls against Jon Corzine during the 2009 governors race;0.25;0.4213417006879284;-0.17134170068792842;10;15
Says Donald Trump spent the least amount of money of any of the competitive primary contenders that he beat so badly;0.75;0.4919174123931961;0.2580825876068039;12;20
A Houston school district analysis found that the State Board of Education more than quadrupled the number of historical figures students must learn about;0.5;0.5004292158866583;-0.00042921588665834065;14;23
Floridas high school graduation rates continue to increase at the fastest rate in the nation with Florida leading the nation in the rate of Hispanic graduates;0.5;0.47942548510445715;0.02057451489554285;21;25
Says his plan to raise car registration to $56 would still leave Virginia with a fee thats equal to or lower than most states;0;0.4073613704320189;-0.4073613704320189;11;23
We spend half a trillion dollars a year in tax preparation;0.25;0.5324883705488646;-0.28248837054886455;9;10
For GM to pay back everything it owes it would have to sell its shares at $143 a share where the highest value of a General Motors share ever was $43 $44 $46 whatever the dollars were . . ;0;0.3956681021032318;-0.3956681021032318;13;38
Theres 21 congressmen and senators that have been convicted of felonies that still get their retirement even in jail. They dont have to wait until theyre 65;0.75;0.4039460218893822;0.3460539781106178;12;26
Says Mitt Romney said at a January 2012 debate that under Paul Ryans tax plan Id have paid no taxes in the last two years;0.25;0.4138641641699903;-0.16386416416999028;16;24
House Republicans pledged to introduce a bill to reform Americas health care system but the party of no has failed to produce legislation;0.5;0.32038527570825315;0.17961472429174685;14;22
Polls show Americans are overwhelmingly opposed to Obamacare especially the individual mandate;0.75;0.3013628365858726;0.4486371634141274;9;11
The House of Delegates budget bill cuts $50 million from education;1;0.4214387398107605;0.5785612601892395;8;10
In Texas we teach both creationism and evolution in our public schools;0;0.5300970329972836;-0.5300970329972836;5;11
A telecom bill could keep the State Corporation Commission from getting rate-of-return information from electric utilities;0;0.4135548969240188;-0.4135548969240188;5;15
Portland Public Schools invites well-paid well-fed school bureaucrats administrators teachers other staff non-needy students affluent parents of students and other adults including on the other extreme the adult homeless illegal aliens fanatical Muslim terrorists or drug addicted street people to enjoy cheap breakfasts in taxpayer-paid school facilities amidst school children;0.25;0.43200740028115103;-0.18200740028115103;13;49
McCain lobbied for a $10-million pork project honoring conservative justice;0.75;1.0;-0.25;2;9
We have been confronted with an unexpected storm that has hit the metropolitan area;0.25;0.4312952150577989;-0.1812952150577989;6;13
Among manufacturers with fewer than 50 employees the average cost in terms of regulations is $34000 per employee;0.5;0.40401613760123045;0.09598386239876955;8;17
The health care bill will create 4 million jobs 400000 jobs almost immediately;0.5;0.29076563382314013;0.20923436617685987;8;12
U.S. Rep. Scott Rigell wants gun owners in a federal registration system;0;0.26504488455053055;-0.26504488455053055;4;11
Says pension contributions under Gov. Chris Christie would represent 75 percent of the total contribution made between the years 1995 and 2010. Thats right in 15 years total state contribution was only $2.1 billion;0;0.5055022616208251;-0.5055022616208251;12;33
The water quality in the ocean is perfect. Its been tested up and down every ocean shore in New Jersey;0.75;0.4250241925334828;0.3249758074665172;10;19
I balanced the budget for four straight years paid off $405 billion in debt;0;0.3615147398032006;-0.3615147398032006;9;13
Sherrod Brown was just voted two years in a row the most liberal senator in the United States of America and is more liberal than Sen. Bernie Sanders;0.5;0.4332964710974574;0.06670352890254261;21;27
Greg Abbott did nothing to pursue reports of the sexual abuse of boys at a West Texas state-run school;0.25;0.2296457474732817;0.020354252526718297;11;18
The governor must inform the Senate president about his or her absence from the state;0.25;0.4148432400276745;-0.16484324002767448;8;14
We have my opponent Sam Olens to thank for the Arizona immigration ruling since he was on the team that got Clinton elected;0;0.31752268911457415;-0.31752268911457415;14;22
A majority of Americans since Harry Truman days support single-payer health insurance or full Medicare for all;0;0.3749143192997708;-0.3749143192997708;10;16
Says Ohio Gov. John Kasich had the worst rating on spending of any governor in the country Republican or Democrat;0.5;0.3793894715678172;0.12061052843218278;15;19
The Benghazi probe is the longest-running congressional investigation ever;0;0.2983733683495339;-0.2983733683495339;2;8
Says Jeb Bush extended early voting after seeing long lines;0.25;0.30101420103012766;-0.05101420103012766;5;9
Says President Barack Obama thinks Americans are lazy;0.25;0.1985102038582095;0.0514897961417905;5;7
Says Gov. Scott Walker has caused Wisconsin to lose more jobs than any other state in the country;0.5;0.36331585480888406;0.13668414519111594;15;17
A measure to repeal the states prevailing wage law would make it easier for state contractors to hire illegal workers for Wisconsin construction jobs through an illegal worker loophole in the state budget;0;0.3540566542134703;-0.3540566542134703;21;32
Almost 400 arrests in the city last year for panhandling-related offenses involved just 78 suspects an indication that the same people are panhandling over and over;0.75;0.4735167400568554;0.2764832599431446;10;25
Says more than 2 million Oregonians have received important medical services because of his health plan;0.5;0.4735167400568554;0.0264832599431446;10;15
Pending a federal waiver the 2013 Legislature eliminated the overtesting of students in grades 3-8 by decreasing the number of tests from 17 to 8;0.5;0.5229619736971566;-0.02296197369715658;7;24
We have asked public employees to pay 10 percent of the costs of their guaranteed pension and 15 percent of the cost of their health care. The leadership of those public employees unions dont want to pay anything;0.25;0.4333981373315333;-0.18339813733153332;28;37
The United States government and its Constitution says that people can be put to death;1;0.2952929586949642;0.7047070413050358;12;14
Obama spokesman Bill Burton says Clinton gave Bush a blank check on a critical foreign policy issue;0.5;0.49068490887423444;0.009315091125765562;7;16
A law was passed apparently in the Clinton administration about whether in recruiting offices Marines or other military should be able to have guns. Apparently it is prohibited;0.25;0.3068940344565203;-0.056894034456520304;14;27
We had the Democratic Governors Association and the Obama political machine come into a Republican primary to try and rig the election by spending $1 million against me in the last couple of days;0.75;0.3727933134932844;0.3772066865067156;20;33
Stimulus money funded a government board that made recommendations that would cost 378000 jobs and $28.3 billion in sales;0;0.2938190377222184;-0.2938190377222184;10;18
In the last 10 years only one piece of legislation has been cosponsored and passed by John Duncan Jr;0;0.4030592415562695;-0.4030592415562695;11;18
There are cities and counties in Georgia that dont have websites and where elected officials dont have email addresses;1;0.41132781420852105;0.588672185791479;9;18
I never was in favor of shutting down the government. I voted to fund the government fully;0.25;0.23385795301081969;0.016142046989180314;12;16
The Confederate battle flag never flew over Texas but you might soon see it on our license plates;0.5;0.40242870483030835;0.09757129516969165;8;17
Says PETA is using this really fancy drone to follow hunters around in some places in other countries;0.5;0.3580933950068347;0.14190660499316532;5;17
United States students are achieving at number 25 out of 29 developing countries when it comes to science and math;0;0.5576287133451587;-0.5576287133451587;9;19
Says Mitt Romney backed a bill that outlaws all abortions even in cases of rape and incest;0;0.4772142894254938;-0.4772142894254938;13;16
Says North Carolina is home of the largest military installations in the world;0.75;0.3532414643945643;0.3967585356054357;9;12
In the last three years alone 13 times the Supreme Court unanimously 9-0 including all of the presidents liberal picks have struck down the presidents executive orders;0;0.4675797752670493;-0.4675797752670493;13;26
In Libya America spent $2 billion total and didnt lose a single life;0.75;0.2883852424103057;0.4616147575896943;6;12
20 percent of the time smart guns wont work;0;1.0;-1.0;4;8
If you look at the income of average Americanstheyre absolutely flat in constant dollars since 1979;0.75;0.4598248816651811;0.2901751183348189;8;15
The Rhode Island Parole Board never received an objection from the attorney general to the parole of convicted murder Alfred Brissette;1;0.29862069394706425;0.7013793060529357;7;20
Its highly unusual to have a Supreme Court confirmation in a presidential election year. The last one was 1940;0.5;0.5207688444425912;-0.020768844442591194;10;18
Guantanamo has never been a key component of ISIS or al-Qaida propaganda;1;0.3550132888562927;0.6449867111437073;6;11
Rep. Adam Putnam was silent when Rush Limbaugh called Sonia Sotomayor a racist;0;0.16607406734943797;-0.16607406734943797;6;12
George Allens flat tax plan would actually shrink revenues further thanthe Perry flat tax plan;0;0.4875033782309802;-0.4875033782309802;6;14
Right now Texas doesnt have an income tax and Oklahomas lowering their income tax rates and guess what their severance tax is? Sky high;1;0.40452984775948553;0.5954701522405145;14;23
Sarah Palin has had 12 years of elected office experience;1;0.1811827893548501;0.8188172106451499;8;9
DEP has 2812 employees the lowest level since the mid-80s;0.5;1.0;-0.5;4;9
There are tens of thousands of homes right here in California where you turn on the faucet but you cant drink the water;0.5;0.39700278676264034;0.10299721323735966;12;22
The largest number of bankruptcies in our country are really as a result of health care;0.5;0.37453799232214136;0.12546200767785864;12;15
Marco Rubio has the No. 1absentee record in the United States Senate;0.75;0.5963340436729315;0.15366595632706848;9;11
If your plan is the result of collective bargaining no subsequent changes by anybody  insurance companies Obamacare  can force your grandfathered policy to change;0.25;0.30323608410272784;-0.05323608410272784;12;23
Oregon has the sixth highest combined death tax rate in the country;0.25;0.4484087822948838;-0.1984087822948838;8;11
The man who killed a motorist who fatally struck a 2-year-old was back on the street because he had received a 13-year sentence for bank robbery but only served two years;0.25;0.3655501273036751;-0.11555012730367509;10;30
When I left office there was a $7-million surplus in Providence but in 2008 the city had a $110-million deficit;0.5;0.27721791728555767;0.22278208271444233;14;19
More Hispanics have fallen into poverty under Obama;0.5;0.4402461755303554;0.05975382446964461;6;7
This year the federal government will have more revenue than any year in the history of our country;0.5;0.40392107951927014;0.09607892048072986;17;17
Any government-run public plan creates an entitlement that will cost another $1 trillion over the next 10 years;0.5;0.317497889041103;0.182502110958897;13;17
If you count United States airstrikes against ISIS 75 percent of those combat missions return to base without having fired a weapon;1;0.4072550974066286;0.5927449025933714;9;21
Says President Barack Obama is not paying women equally by his own measures in his own White House;0.25;0.24617850007903774;0.003821499920962257;11;17
Says that as a U.S. senator Scott Brown delivered for Wall Street saving big banks $19 billion in taxes;0.25;0.3635177628675098;-0.11351776286750981;12;18
The fact is over 2.4 million jobs have been lost since the Stimulus bill was signed into law in February of 2009;0.5;0.3770426223503417;0.1229573776496583;19;21
The rate in which people are working in Wisconsin is almost five points higher than it is nationally;0.75;0.6446304737935475;0.10536952620645246;14;17
If African-Americans vote their percentage of the population in 2008 Mississippi is suddenly a Democratic state;0;0.45628773467360983;-0.45628773467360983;7;15
Hillary Clinton surged the trade deficit with China 40% as Secretary of State costing Americans millions of jobs;0.25;0.3465652347824094;-0.09656523478240941;10;17
Says Ann Kuster said the debate over Americas debt limit is not an important issue of the day;0;0.3730066225361417;-0.3730066225361417;12;17
On whether to eliminate the state income tax;0.5;0.3074854864268878;0.19251451357311222;7;7
ISISsends out 90000 social mediamessages a day;0.75;1.0;-0.25;1;6
